game_id,game_date,away_team,home_team,away_score,home_score,inning,half_inning,at_bat_index,balls,strikes,outs,batter_id,batter_name,batter_side,pitcher_id,pitcher_name,pitcher_hand,event,event_type,description,rbi,away_score_after,home_score_after,runner_id,runner_name,start_base,end_base,is_out,out_number
529428,2018-03-30,Philadelphia Phillies,Atlanta Braves,5,4,5,bottom,41,3,1,2,645277,Ozzie Albies,L,644364,Víctor Arano,R,Pop Out,field_out,Ozzie Albies pops out to first baseman Carlos Santana in foul territory.,0,3,3,,,,,,
529428,2018-03-30,Philadelphia Phillies,Atlanta Braves,5,4,5,bottom,42,4,1,2,518692,Freddie Freeman,L,571948,Hoby Milner,L,Walk,walk,Freddie Freeman walks.,0,3,3,,,,,,
529428,2018-03-30,Philadelphia Phillies,Atlanta Braves,5,4,5,bottom,43,0,0,3,455976,Nick Markakis,L,571948,Hoby Milner,L,Flyout,field_out,Nick Markakis flies out to left fielder Rhys Hoskins.,0,3,3,,,,,,
529428,2018-03-30,Philadelphia Phillies,Atlanta Braves,5,4,6,top,44,4,1,0,571437,Aaron Altherr,R,542432,José Ramirez,R,Walk,walk,Aaron Altherr walks.,0,3,3,,,,,,
529428,2018-03-30,Philadelphia Phillies,Atlanta Braves,5,4,6,top,45,2,1,1,664068,Scott Kingery,R,542432,José Ramirez,R,Lineout,field_out,Scott Kingery lines out to right fielder Nick Markakis.,0,3,3,571437.0,Aaron Altherr,1B,2B,False,
529428,2018-03-30,Philadelphia Phillies,Atlanta Braves,5,4,6,top,46,1,3,2,595284,Andrew Knapp,L,542432,José Ramirez,R,Strikeout,strikeout,Andrew Knapp strikes out swinging.,0,3,3,,,,,,
529428,2018-03-30,Philadelphia Phillies,Atlanta Braves,5,4,6,top,47,0,2,2,608384,Nick Williams,L,542432,José Ramirez,R,Single,single,Nick Williams singles on a line drive to left fielder Preston Tucker. Aaron Altherr scores.,1,4,3,571437.0,Aaron Altherr,2B,score,False,
529428,2018-03-30,Philadelphia Phillies,Atlanta Braves,5,4,6,top,48,2,1,3,641487,J.P. Crawford,L,542432,José Ramirez,R,Groundout,field_out,J.P. Crawford grounds out to first baseman Freddie Freeman.,0,4,3,608384.0,Nick Williams,1B,2B,False,
529428,2018-03-30,Philadelphia Phillies,Atlanta Braves,5,4,6,bottom,49,0,0,1,455755,Chris Stewart,R,591693,Edubray Ramos,R,Lineout,field_out,Chris Stewart lines out to center fielder Odubel Herrera.,0,4,3,,,,,,
529428,2018-03-30,Philadelphia Phillies,Atlanta Braves,5,4,6,bottom,50,0,1,2,605512,Preston Tucker,L,605388,Adam Morgan,L,Pop Out,field_out,Preston Tucker pops out to second baseman Cesar Hernandez.,0,4,3,,,,,,
529428,2018-03-30,Philadelphia Phillies,Atlanta Braves,5,4,6,bottom,51,3,3,3,621020,Dansby Swanson,R,605388,Adam Morgan,L,Strikeout,strikeout,Dansby Swanson strikes out swinging.,0,4,3,,,,,,
529428,2018-03-30,Philadelphia Phillies,Atlanta Braves,5,4,7,top,52,4,2,0,514917,César Hernández,R,518693,Sam Freeman,L,Walk,walk,Cesar Hernandez walks.,0,4,3,,,,,,
529428,2018-03-30,Philadelphia Phillies,Atlanta Braves,5,4,7,top,53,3,2,2,467793,Carlos Santana,R,518693,Sam Freeman,L,Grounded Into DP,grounded_into_double_play,"Carlos Santana grounds into a double play, shortstop Dansby Swanson to second baseman Ozzie Albies to first baseman Freddie Freeman. Cesar Hernandez out at 2nd. Carlos Santana out at 1st.",0,4,3,,,,,,
529428,2018-03-30,Philadelphia Phillies,Atlanta Braves,5,4,7,top,54,1,2,3,546318,Odúbel Herrera,L,518693,Sam Freeman,L,Groundout,field_out,"Odubel Herrera grounds out softly, pitcher Sam Freeman to first baseman Freddie Freeman.",0,4,3,,,,,,
529428,2018-03-30,Philadelphia Phillies,Atlanta Braves,5,4,7,bottom,55,2,3,1,475247,Ryan Flaherty,L,605388,Adam Morgan,L,Strikeout,strikeout,Ryan Flaherty called out on strikes.,0,4,3,,,,,,
529428,2018-03-30,Philadelphia Phillies,Atlanta Braves,5,4,7,bottom,56,0,3,2,572669,Lane Adams,R,605441,Yacksel Ríos,R,Strikeout,strikeout,Lane Adams strikes out swinging.,0,4,3,,,,,,
529428,2018-03-30,Philadelphia Phillies,Atlanta Braves,5,4,7,bottom,57,1,2,2,542255,Ender Inciarte,L,605441,Yacksel Ríos,R,Single,single,Ender Inciarte singles on a soft ground ball to second baseman Cesar Hernandez.,0,4,3,,,,,,
529428,2018-03-30,Philadelphia Phillies,Atlanta Braves,5,4,7,bottom,58,0,0,3,645277,Ozzie Albies,L,605441,Yacksel Ríos,R,Groundout,field_out,"Ozzie Albies grounds out, second baseman Cesar Hernandez to first baseman Carlos Santana.",0,4,3,,,,,,
529428,2018-03-30,Philadelphia Phillies,Atlanta Braves,5,4,8,top,59,1,2,0,656555,Rhys Hoskins,R,493247,Peter Moylan,R,Single,single,Rhys Hoskins singles on a line drive to right fielder Nick Markakis.,0,4,3,,,,,,
529428,2018-03-30,Philadelphia Phillies,Atlanta Braves,5,4,8,top,60,2,2,1,571437,Aaron Altherr,R,493247,Peter Moylan,R,Lineout,field_out,Aaron Altherr lines out to second baseman Ozzie Albies.,0,4,3,,,,,,
529428,2018-03-30,Philadelphia Phillies,Atlanta Braves,5,4,8,top,61,0,1,1,664068,Scott Kingery,R,493247,Peter Moylan,R,Single,single,Scott Kingery singles on a sharp ground ball to center fielder Ender Inciarte. Rhys Hoskins to 2nd.,0,4,3,656555.0,Rhys Hoskins,1B,2B,False,
529428,2018-03-30,Philadelphia Phillies,Atlanta Braves,5,4,8,top,62,2,2,2,595284,Andrew Knapp,R,621345,A.J. Minter,L,Forceout,force_out,"Andrew Knapp grounds into a force out, first baseman Freddie Freeman to shortstop Dansby Swanson. Rhys Hoskins to 3rd. Scott Kingery out at 2nd. Andrew Knapp to 1st.",0,4,3,656555.0,Rhys Hoskins,2B,3B,False,
529428,2018-03-30,Philadelphia Phillies,Atlanta Braves,5,4,8,top,63,3,2,3,596748,Maikel Franco,R,621345,A.J. Minter,L,Flyout,field_out,Maikel Franco flies out to left fielder Preston Tucker.,0,4,3,,,,,,
529428,2018-03-30,Philadelphia Phillies,Atlanta Braves,5,4,8,bottom,64,4,1,0,518692,Freddie Freeman,L,472610,Luis García,R,Walk,walk,Freddie Freeman walks.,0,4,3,,,,,,
529428,2018-03-30,Philadelphia Phillies,Atlanta Braves,5,4,8,bottom,65,0,2,1,455976,Nick Markakis,L,472610,Luis García,R,Groundout,field_out,"Nick Markakis grounds out, pitcher Luis Garcia to second baseman Cesar Hernandez. Freddie Freeman to 3rd.",0,4,3,518692.0,Freddie Freeman,1B,2B,False,
529428,2018-03-30,Philadelphia Phillies,Atlanta Braves,5,4,8,bottom,65,0,2,1,455976,Nick Markakis,L,472610,Luis García,R,Groundout,field_out,"Nick Markakis grounds out, pitcher Luis Garcia to second baseman Cesar Hernandez. Freddie Freeman to 3rd.",0,4,3,518692.0,Freddie Freeman,2B,3B,False,
529428,2018-03-30,Philadelphia Phillies,Atlanta Braves,5,4,8,bottom,66,1,0,2,455755,Chris Stewart,R,472610,Luis García,R,Groundout,field_out,"Chris Stewart grounds out, second baseman Cesar Hernandez to first baseman Carlos Santana.",0,4,3,,,,,,
529428,2018-03-30,Philadelphia Phillies,Atlanta Braves,5,4,8,bottom,67,2,2,2,605512,Preston Tucker,L,472610,Luis García,R,Single,single,Preston Tucker singles on a line drive to left fielder Rhys Hoskins. Freddie Freeman scores.,1,4,4,518692.0,Freddie Freeman,3B,score,False,
529428,2018-03-30,Philadelphia Phillies,Atlanta Braves,5,4,8,bottom,68,0,1,3,621020,Dansby Swanson,R,472610,Luis García,R,Double,double,"Phillies challenged (tag play), call on the field was overturned: Dansby Swanson doubles (1) on a line drive to left fielder Rhys Hoskins. Peter Bourjos out at home on the throw, left fielder Rhys Hoskins to shortstop J. P. Crawford to catcher Andrew Knapp.",0,4,4,488721.0,Peter Bourjos,1B,3B,False,
529428,2018-03-30,Philadelphia Phillies,Atlanta Braves,5,4,9,top,69,1,1,1,641487,J.P. Crawford,L,527055,Arodys Vizcaíno,R,Lineout,field_out,J.P. Crawford lines out to left fielder Peter Bourjos.,0,4,4,,,,,,
529428,2018-03-30,Philadelphia Phillies,Atlanta Braves,5,4,9,top,70,4,1,1,514917,César Hernández,L,527055,Arodys Vizcaíno,R,Walk,walk,Cesar Hernandez walks.,0,4,4,,,,,,
529428,2018-03-30,Philadelphia Phillies,Atlanta Braves,5,4,9,top,71,4,0,1,467793,Carlos Santana,L,527055,Arodys Vizcaíno,R,Walk,walk,Carlos Santana walks. Cesar Hernandez to 2nd.,0,4,4,514917.0,César Hernández,1B,2B,False,
529428,2018-03-30,Philadelphia Phillies,Atlanta Braves,5,4,9,top,72,2,2,2,546318,Odúbel Herrera,L,527055,Arodys Vizcaíno,R,Forceout,force_out,"Odubel Herrera grounds into a force out, first baseman Freddie Freeman to shortstop Charlie Culberson. Cesar Hernandez to 3rd. Carlos Santana out at 2nd. Odubel Herrera to 1st.",0,4,4,514917.0,César Hernández,2B,3B,False,
529428,2018-03-30,Philadelphia Phillies,Atlanta Braves,5,4,9,top,73,1,3,3,656555,Rhys Hoskins,R,527055,Arodys Vizcaíno,R,Strikeout,strikeout,Rhys Hoskins strikes out swinging.,0,4,4,,,,,,
529428,2018-03-30,Philadelphia Phillies,Atlanta Braves,5,4,9,bottom,74,0,0,1,475247,Ryan Flaherty,L,593576,Héctor Neris,R,Lineout,field_out,Ryan Flaherty lines out to left fielder Rhys Hoskins.,0,4,4,,,,,,
529428,2018-03-30,Philadelphia Phillies,Atlanta Braves,5,4,9,bottom,75,3,3,2,518586,Charlie Culberson,R,593576,Héctor Neris,R,Strikeout,strikeout,Charlie Culberson called out on strikes.,0,4,4,,,,,,
529428,2018-03-30,Philadelphia Phillies,Atlanta Braves,5,4,9,bottom,76,2,0,3,542255,Ender Inciarte,L,593576,Héctor Neris,R,Groundout,field_out,"Ender Inciarte grounds out softly, second baseman Cesar Hernandez to first baseman Carlos Santana.",0,4,4,,,,,,
529428,2018-03-30,Philadelphia Phillies,Atlanta Braves,5,4,10,top,77,1,2,1,571437,Aaron Altherr,R,641438,Shane Carle,R,Groundout,field_out,"Aaron Altherr grounds out softly, third baseman Ryan Flaherty to first baseman Freddie Freeman.",0,4,4,,,,,,
529428,2018-03-30,Philadelphia Phillies,Atlanta Braves,5,4,10,top,78,2,2,2,664068,Scott Kingery,R,641438,Shane Carle,R,Flyout,field_out,Scott Kingery flies out to right fielder Nick Markakis.,0,4,4,,,,,,
529428,2018-03-30,Philadelphia Phillies,Atlanta Braves,5,4,10,top,79,2,2,3,595284,Andrew Knapp,L,641438,Shane Carle,R,Flyout,field_out,Andrew Knapp flies out to right fielder Nick Markakis.,0,4,4,,,,,,
529428,2018-03-30,Philadelphia Phillies,Atlanta Braves,5,4,10,bottom,80,1,2,1,645277,Ozzie Albies,L,571800,Drew Hutchison,R,Flyout,field_out,Ozzie Albies flies out to left fielder Rhys Hoskins.,0,4,4,,,,,,
529428,2018-03-30,Philadelphia Phillies,Atlanta Braves,5,4,10,bottom,81,3,3,2,518692,Freddie Freeman,L,571800,Drew Hutchison,R,Strikeout,strikeout,Freddie Freeman strikes out on a foul tip.,0,4,4,,,,,,
529428,2018-03-30,Philadelphia Phillies,Atlanta Braves,5,4,10,bottom,82,4,2,2,455976,Nick Markakis,L,571800,Drew Hutchison,R,Walk,walk,Nick Markakis walks.,0,4,4,,,,,,
529428,2018-03-30,Philadelphia Phillies,Atlanta Braves,5,4,10,bottom,83,2,2,3,455755,Chris Stewart,R,571800,Drew Hutchison,R,Groundout,field_out,"Chris Stewart grounds out, shortstop J. P. Crawford to first baseman Carlos Santana.",0,4,4,,,,,,
529428,2018-03-30,Philadelphia Phillies,Atlanta Braves,5,4,11,top,84,1,3,1,595751,Jorge Alfaro,R,641438,Shane Carle,R,Strikeout,strikeout,Jorge Alfaro strikes out swinging.,0,4,4,,,,,,
529428,2018-03-30,Philadelphia Phillies,Atlanta Braves,5,4,11,top,85,3,2,1,641487,J.P. Crawford,L,641438,Shane Carle,R,Single,single,J.P. Crawford singles on a line drive to center fielder Ender Inciarte.,0,4,4,,,,,,
529428,2018-03-30,Philadelphia Phillies,Atlanta Braves,5,4,11,top,86,2,1,1,514917,César Hernández,L,641438,Shane Carle,R,Single,single,Cesar Hernandez singles on a line drive to right fielder Nick Markakis. J.P. Crawford to 3rd.,0,4,4,641487.0,J.P. Crawford,1B,2B,False,
529428,2018-03-30,Philadelphia Phillies,Atlanta Braves,5,4,11,top,86,2,1,1,514917,César Hernández,L,641438,Shane Carle,R,Single,single,Cesar Hernandez singles on a line drive to right fielder Nick Markakis. J.P. Crawford to 3rd.,0,4,4,641487.0,J.P. Crawford,2B,3B,False,
529428,2018-03-30,Philadelphia Phillies,Atlanta Braves,5,4,11,top,87,2,2,2,467793,Carlos Santana,L,641438,Shane Carle,R,Sac Fly,sac_fly,Carlos Santana out on a sacrifice fly to left fielder Peter Bourjos. J.P. Crawford scores. Cesar Hernandez to 2nd.,1,5,4,641487.0,J.P. Crawford,3B,score,False,
529428,2018-03-30,Philadelphia Phillies,Atlanta Braves,5,4,11,top,87,2,2,2,467793,Carlos Santana,L,641438,Shane Carle,R,Sac Fly,sac_fly,Carlos Santana out on a sacrifice fly to left fielder Peter Bourjos. J.P. Crawford scores. Cesar Hernandez to 2nd.,1,5,4,514917.0,César Hernández,1B,2B,False,
529428,2018-03-30,Philadelphia Phillies,Atlanta Braves,5,4,11,top,88,1,0,3,546318,Odúbel Herrera,L,641438,Shane Carle,R,Groundout,field_out,"Odubel Herrera grounds out, second baseman Ozzie Albies to first baseman Freddie Freeman.",0,5,4,,,,,,
529428,2018-03-30,Philadelphia Phillies,Atlanta Braves,5,4,11,bottom,89,0,1,1,488721,Peter Bourjos,R,571800,Drew Hutchison,R,Groundout,field_out,"Peter Bourjos grounds out, shortstop J. P. Crawford to first baseman Carlos Santana.",0,5,4,,,,,,
529428,2018-03-30,Philadelphia Phillies,Atlanta Braves,5,4,11,bottom,90,1,3,2,641438,Shane Carle,R,571800,Drew Hutchison,R,Strikeout,strikeout,Shane Carle called out on strikes.,0,5,4,,,,,,
529428,2018-03-30,Philadelphia Phillies,Atlanta Braves,5,4,11,bottom,91,2,0,2,475247,Ryan Flaherty,L,571800,Drew Hutchison,R,Single,single,Ryan Flaherty singles on a ground ball to center fielder Odubel Herrera.,0,5,4,,,,,,
529428,2018-03-30,Philadelphia Phillies,Atlanta Braves,5,4,11,bottom,92,2,1,2,518586,Charlie Culberson,R,571800,Drew Hutchison,R,Hit By Pitch,hit_by_pitch,Charlie Culberson hit by pitch. Ryan Flaherty to 2nd.,0,5,4,475247.0,Ryan Flaherty,1B,2B,False,
529428,2018-03-30,Philadelphia Phillies,Atlanta Braves,5,4,11,bottom,93,0,0,3,542255,Ender Inciarte,L,571800,Drew Hutchison,R,Flyout,field_out,Ender Inciarte flies out to center fielder Odubel Herrera.,0,5,4,,,,,,
529424,2018-03-30,Houston Astros,Texas Rangers,1,5,1,top,0,0,3,1,543807,George Springer,R,450729,Doug Fister,R,Strikeout,strikeout,George Springer called out on strikes.,0,0,0,,,,,,
529424,2018-03-30,Houston Astros,Texas Rangers,1,5,1,top,1,4,2,1,502210,Josh Reddick,L,450729,Doug Fister,R,Walk,walk,Josh Reddick walks.,0,0,0,,,,,,
529424,2018-03-30,Houston Astros,Texas Rangers,1,5,1,top,2,2,1,2,514888,Jose Altuve,R,450729,Doug Fister,R,Forceout,force_out,"Jose Altuve grounds into a force out, third baseman Adrian Beltre to second baseman Rougned Odor. Josh Reddick out at 2nd. Jose Altuve to 1st.",0,0,0,,,,,,
529424,2018-03-30,Houston Astros,Texas Rangers,1,5,1,top,3,0,0,3,621043,Carlos Correa,R,450729,Doug Fister,R,Pop Out,field_out,Carlos Correa pops out softly to first baseman Joey Gallo.,0,0,0,,,,,,
529424,2018-03-30,Houston Astros,Texas Rangers,1,5,1,bottom,4,2,2,1,592261,Delino DeShields,R,572971,Dallas Keuchel,L,Groundout,field_out,"Delino DeShields grounds out, shortstop Carlos Correa to first baseman Marwin Gonzalez.",0,0,0,,,,,,
529424,2018-03-30,Houston Astros,Texas Rangers,1,5,1,bottom,5,0,1,1,608336,Joey Gallo,L,572971,Dallas Keuchel,L,Single,single,Joey Gallo singles on a line drive to left fielder Derek Fisher.,0,0,0,,,,,,
529424,2018-03-30,Houston Astros,Texas Rangers,1,5,1,bottom,6,3,2,3,462101,Elvis Andrus,R,572971,Dallas Keuchel,L,Grounded Into DP,grounded_into_double_play,"Elvis Andrus grounds into a double play, shortstop Carlos Correa to second baseman Jose Altuve to first baseman Marwin Gonzalez. Joey Gallo out at 2nd. Elvis Andrus out at 1st.",0,0,0,,,,,,
529424,2018-03-30,Houston Astros,Texas Rangers,1,5,2,top,7,4,0,0,608324,Alex Bregman,R,450729,Doug Fister,R,Walk,walk,Alex Bregman walks.,0,0,0,,,,,,
529424,2018-03-30,Houston Astros,Texas Rangers,1,5,2,top,8,3,2,1,503556,Marwin Gonzalez,L,450729,Doug Fister,R,Flyout,field_out,Marwin Gonzalez flies out to left fielder Ryan Rua.,0,0,0,,,,,,
529424,2018-03-30,Houston Astros,Texas Rangers,1,5,2,top,9,1,2,2,594828,Evan Gattis,R,450729,Doug Fister,R,Lineout,field_out,Evan Gattis lines out to pitcher Doug Fister.,0,0,0,,,,,,
529424,2018-03-30,Houston Astros,Texas Rangers,1,5,2,top,10,2,1,3,605233,Derek Fisher,L,450729,Doug Fister,R,Lineout,field_out,Derek Fisher lines out to first baseman Joey Gallo.,0,0,0,,,,,,
529424,2018-03-30,Houston Astros,Texas Rangers,1,5,2,bottom,11,2,2,1,134181,Adrian Beltré,R,572971,Dallas Keuchel,L,Groundout,field_out,"Adrian Beltre grounds out sharply, pitcher Dallas Keuchel to first baseman Marwin Gonzalez.",0,0,0,,,,,,
529424,2018-03-30,Houston Astros,Texas Rangers,1,5,2,bottom,12,0,1,1,608577,Nomar Mazara,L,572971,Dallas Keuchel,L,Home Run,home_run,Nomar Mazara homers (1) on a fly ball to center field.,1,0,1,,,,,,
529424,2018-03-30,Houston Astros,Texas Rangers,1,5,2,bottom,13,1,2,1,425783,Shin-Soo Choo,L,572971,Dallas Keuchel,L,Single,single,Shin-Soo Choo singles on a line drive to center fielder George Springer.,0,0,1,,,,,,
529424,2018-03-30,Houston Astros,Texas Rangers,1,5,2,bottom,14,3,2,3,455139,Robinson Chirinos,R,572971,Dallas Keuchel,L,Grounded Into DP,grounded_into_double_play,"Robinson Chirinos grounds into a double play, third baseman Alex Bregman to second baseman Jose Altuve to first baseman Marwin Gonzalez. Shin-Soo Choo out at 2nd. Robinson Chirinos out at 1st.",0,0,1,,,,,,
529424,2018-03-30,Houston Astros,Texas Rangers,1,5,3,top,15,2,3,1,545358,Max Stassi,R,450729,Doug Fister,R,Strikeout,strikeout,Max Stassi called out on strikes.,0,0,1,,,,,,
529424,2018-03-30,Houston Astros,Texas Rangers,1,5,3,top,16,0,1,1,543807,George Springer,R,450729,Doug Fister,R,Single,single,George Springer singles on a sharp ground ball to center fielder Delino DeShields.,0,0,1,,,,,,
529424,2018-03-30,Houston Astros,Texas Rangers,1,5,3,top,17,1,1,3,502210,Josh Reddick,L,450729,Doug Fister,R,Grounded Into DP,grounded_into_double_play,"Josh Reddick grounds into a double play, shortstop Elvis Andrus to second baseman Rougned Odor to first baseman Joey Gallo. George Springer out at 2nd. Josh Reddick out at 1st.",0,0,1,,,,,,
529424,2018-03-30,Houston Astros,Texas Rangers,1,5,3,bottom,18,1,3,1,596059,Rougned Odor,L,572971,Dallas Keuchel,L,Strikeout,strikeout,Rougned Odor called out on strikes.,0,0,1,,,,,,
529424,2018-03-30,Houston Astros,Texas Rangers,1,5,3,bottom,19,0,0,1,607387,Ryan Rua,R,572971,Dallas Keuchel,L,Field Error,field_error,"Astros challenged (play at 1st), call on the field was upheld: Ryan Rua reaches on a throwing error by third baseman Alex Bregman.",0,0,1,,,,,,
529424,2018-03-30,Houston Astros,Texas Rangers,1,5,3,bottom,20,2,0,1,592261,Delino DeShields,R,572971,Dallas Keuchel,L,Single,single,Delino DeShields singles on a line drive to right fielder Josh Reddick. Ryan Rua to 2nd.,0,0,1,607387.0,Ryan Rua,1B,2B,False,
529424,2018-03-30,Houston Astros,Texas Rangers,1,5,3,bottom,21,2,3,2,608336,Joey Gallo,L,572971,Dallas Keuchel,L,Strikeout,strikeout,Joey Gallo strikes out swinging.,0,0,1,,,,,,
529424,2018-03-30,Houston Astros,Texas Rangers,1,5,3,bottom,22,2,2,3,462101,Elvis Andrus,R,572971,Dallas Keuchel,L,Forceout,force_out,"Elvis Andrus grounds into a force out, fielded by third baseman Alex Bregman. Ryan Rua out at 3rd.",0,0,1,,,,,,
529424,2018-03-30,Houston Astros,Texas Rangers,1,5,4,top,23,0,1,0,514888,Jose Altuve,R,450729,Doug Fister,R,Single,single,Jose Altuve singles on a line drive to left fielder Ryan Rua.,0,0,1,,,,,,
529424,2018-03-30,Houston Astros,Texas Rangers,1,5,4,top,24,4,2,0,621043,Carlos Correa,R,450729,Doug Fister,R,Walk,walk,Carlos Correa walks. Jose Altuve to 2nd.,0,0,1,514888.0,Jose Altuve,1B,2B,False,
529424,2018-03-30,Houston Astros,Texas Rangers,1,5,4,top,25,0,0,2,608324,Alex Bregman,R,450729,Doug Fister,R,Grounded Into DP,grounded_into_double_play,"Alex Bregman grounds into a double play, shortstop Elvis Andrus to second baseman Rougned Odor to first baseman Joey Gallo. Jose Altuve to 3rd. Carlos Correa out at 2nd. Alex Bregman out at 1st.",0,0,1,514888.0,Jose Altuve,2B,3B,False,
529424,2018-03-30,Houston Astros,Texas Rangers,1,5,4,top,26,1,1,3,503556,Marwin Gonzalez,L,450729,Doug Fister,R,Groundout,field_out,"Marwin Gonzalez grounds out, second baseman Rougned Odor to first baseman Joey Gallo.",0,0,1,,,,,,
529424,2018-03-30,Houston Astros,Texas Rangers,1,5,4,bottom,27,1,1,0,134181,Adrian Beltré,R,572971,Dallas Keuchel,L,Double,double,Adrian Beltre doubles (1) on a sharp ground ball to left fielder Derek Fisher.,0,0,1,,,,,,
529424,2018-03-30,Houston Astros,Texas Rangers,1,5,4,bottom,28,4,0,0,608577,Nomar Mazara,L,572971,Dallas Keuchel,L,Walk,walk,Nomar Mazara walks.,0,0,1,,,,,,
529424,2018-03-30,Houston Astros,Texas Rangers,1,5,4,bottom,29,1,2,0,425783,Shin-Soo Choo,L,572971,Dallas Keuchel,L,Single,single,Shin-Soo Choo singles on a sharp ground ball to center fielder George Springer. Adrian Beltre to 3rd. Nomar Mazara to 2nd.,0,0,1,134181.0,Adrian Beltré,2B,3B,False,
529424,2018-03-30,Houston Astros,Texas Rangers,1,5,4,bottom,29,1,2,0,425783,Shin-Soo Choo,L,572971,Dallas Keuchel,L,Single,single,Shin-Soo Choo singles on a sharp ground ball to center fielder George Springer. Adrian Beltre to 3rd. Nomar Mazara to 2nd.,0,0,1,608577.0,Nomar Mazara,1B,2B,False,
529424,2018-03-30,Houston Astros,Texas Rangers,1,5,4,bottom,30,0,0,1,455139,Robinson Chirinos,R,572971,Dallas Keuchel,L,Sac Fly,sac_fly,Robinson Chirinos out on a sacrifice fly to right fielder Josh Reddick. Adrian Beltre scores. Nomar Mazara to 3rd.,1,0,2,134181.0,Adrian Beltré,3B,score,False,
529424,2018-03-30,Houston Astros,Texas Rangers,1,5,4,bottom,30,0,0,1,455139,Robinson Chirinos,R,572971,Dallas Keuchel,L,Sac Fly,sac_fly,Robinson Chirinos out on a sacrifice fly to right fielder Josh Reddick. Adrian Beltre scores. Nomar Mazara to 3rd.,1,0,2,608577.0,Nomar Mazara,2B,3B,False,
529424,2018-03-30,Houston Astros,Texas Rangers,1,5,4,bottom,31,3,2,2,596059,Rougned Odor,L,572971,Dallas Keuchel,L,Sac Fly,sac_fly,Rougned Odor out on a sacrifice fly to right fielder Josh Reddick. Nomar Mazara scores.,1,0,3,608577.0,Nomar Mazara,3B,score,False,
529424,2018-03-30,Houston Astros,Texas Rangers,1,5,4,bottom,32,2,1,3,607387,Ryan Rua,R,572971,Dallas Keuchel,L,Groundout,field_out,"Ryan Rua grounds out, shortstop Carlos Correa to first baseman Marwin Gonzalez.",0,0,3,,,,,,
529424,2018-03-30,Houston Astros,Texas Rangers,1,5,5,top,33,1,1,0,594828,Evan Gattis,R,450729,Doug Fister,R,Double,double,Evan Gattis doubles (1) on a line drive to right fielder Nomar Mazara.,0,0,3,,,,,,
529424,2018-03-30,Houston Astros,Texas Rangers,1,5,5,top,34,3,3,1,605233,Derek Fisher,L,450729,Doug Fister,R,Strikeout,strikeout,Derek Fisher called out on strikes.,0,0,3,,,,,,
529424,2018-03-30,Houston Astros,Texas Rangers,1,5,5,top,35,0,1,1,545358,Max Stassi,R,450729,Doug Fister,R,Double,double,Max Stassi doubles (1) on a sharp line drive to center fielder Delino DeShields. Evan Gattis scores.,1,1,3,594828.0,Evan Gattis,2B,3B,False,
529424,2018-03-30,Houston Astros,Texas Rangers,1,5,5,top,35,0,1,1,545358,Max Stassi,R,450729,Doug Fister,R,Double,double,Max Stassi doubles (1) on a sharp line drive to center fielder Delino DeShields. Evan Gattis scores.,1,1,3,594828.0,Evan Gattis,3B,score,False,
529424,2018-03-30,Houston Astros,Texas Rangers,1,5,5,top,36,0,1,2,543807,George Springer,R,450729,Doug Fister,R,Flyout,field_out,George Springer flies out to center fielder Delino DeShields.,0,1,3,,,,,,
529424,2018-03-30,Houston Astros,Texas Rangers,1,5,5,top,37,1,2,3,502210,Josh Reddick,L,450729,Doug Fister,R,Groundout,field_out,"Josh Reddick grounds out, pitcher Doug Fister to first baseman Joey Gallo.",0,1,3,,,,,,
529424,2018-03-30,Houston Astros,Texas Rangers,1,5,5,bottom,38,1,0,1,592261,Delino DeShields,R,572971,Dallas Keuchel,L,Groundout,field_out,"Delino DeShields grounds out, third baseman Alex Bregman to first baseman Marwin Gonzalez.",0,1,3,,,,,,
529424,2018-03-30,Houston Astros,Texas Rangers,1,5,5,bottom,39,2,3,2,608336,Joey Gallo,L,572971,Dallas Keuchel,L,Strikeout,strikeout,Joey Gallo strikes out swinging.,0,1,3,,,,,,
529424,2018-03-30,Houston Astros,Texas Rangers,1,5,5,bottom,40,1,1,2,462101,Elvis Andrus,R,572971,Dallas Keuchel,L,Single,single,Elvis Andrus singles on a ground ball to third baseman Alex Bregman.,0,1,3,,,,,,
529424,2018-03-30,Houston Astros,Texas Rangers,1,5,5,bottom,41,2,1,3,134181,Adrian Beltré,R,572971,Dallas Keuchel,L,Lineout,field_out,Adrian Beltre lines out to first baseman Marwin Gonzalez.,0,1,3,462101.0,Elvis Andrus,1B,2B,False,
529424,2018-03-30,Houston Astros,Texas Rangers,1,5,6,top,42,2,1,0,514888,Jose Altuve,R,455119,Chris Martin,R,Single,single,"Rangers challenged (catch or drop), call on the field was upheld: Jose Altuve singles on a sharp line drive to right fielder Nomar Mazara.",0,1,3,,,,,,
529424,2018-03-30,Houston Astros,Texas Rangers,1,5,6,top,43,1,3,1,621043,Carlos Correa,R,455119,Chris Martin,R,Strikeout,strikeout,Carlos Correa strikes out swinging.,0,1,3,,,,,,
529424,2018-03-30,Houston Astros,Texas Rangers,1,5,6,top,44,1,2,1,608324,Alex Bregman,R,455119,Chris Martin,R,Fielders Choice,fielders_choice,"Umpire reviewed (force play), call on the field was overturned: Alex Bregman reaches on a fielder's choice, fielded by shortstop Elvis Andrus. Jose Altuve to 3rd. Alex Bregman to 2nd. Jose Altuve advances to 3rd, on a throwing error by second baseman Rougned Odor.",0,1,3,514888.0,Jose Altuve,1B,2B,False,
529424,2018-03-30,Houston Astros,Texas Rangers,1,5,6,top,44,1,2,1,608324,Alex Bregman,R,455119,Chris Martin,R,Fielders Choice,fielders_choice,"Umpire reviewed (force play), call on the field was overturned: Alex Bregman reaches on a fielder's choice, fielded by shortstop Elvis Andrus. Jose Altuve to 3rd. Alex Bregman to 2nd. Jose Altuve advances to 3rd, on a throwing error by second baseman Rougned Odor.",0,1,3,514888.0,Jose Altuve,2B,3B,False,
529424,2018-03-30,Houston Astros,Texas Rangers,1,5,6,top,44,1,2,1,608324,Alex Bregman,R,455119,Chris Martin,R,Fielders Choice,fielders_choice,"Umpire reviewed (force play), call on the field was overturned: Alex Bregman reaches on a fielder's choice, fielded by shortstop Elvis Andrus. Jose Altuve to 3rd. Alex Bregman to 2nd. Jose Altuve advances to 3rd, on a throwing error by second baseman Rougned Odor.",0,1,3,608324.0,Alex Bregman,1B,2B,False,
529424,2018-03-30,Houston Astros,Texas Rangers,1,5,6,top,45,4,2,1,503556,Marwin Gonzalez,L,455119,Chris Martin,R,Walk,walk,Marwin Gonzalez walks.,0,1,3,,,,,,
