game_id,game_date,away_team,home_team,away_score,home_score,inning,half_inning,at_bat_index,balls,strikes,outs,batter_id,batter_name,batter_side,pitcher_id,pitcher_name,pitcher_hand,event,event_type,description,rbi,away_score_after,home_score_after,runner_id,runner_name,start_base,end_base,is_out,out_number
529435,2018-03-31,Houston Astros,Texas Rangers,9,3,4,top,28,0,2,2,545350,Jake Marisnick,R,519043,Matt Moore,L,Lineout,field_out,Jake Marisnick lines out sharply to center fielder Carlos Tocci.,0,4,1,,,,,,
529435,2018-03-31,Houston Astros,Texas Rangers,9,3,4,top,29,2,3,3,543807,George Springer,R,519043,Matt Moore,L,Strikeout,strikeout,George Springer strikes out swinging.,0,4,1,,,,,,
529435,2018-03-31,Houston Astros,Texas Rangers,9,3,4,bottom,30,3,3,1,134181,Adrian Beltré,R,621121,Lance McCullers Jr.,R,Strikeout,strikeout,Adrian Beltre strikes out on a foul tip.,0,4,1,,,,,,
529435,2018-03-31,Houston Astros,Texas Rangers,9,3,4,bottom,31,1,0,1,608577,Nomar Mazara,L,621121,Lance McCullers Jr.,R,Single,single,Nomar Mazara singles on a sharp ground ball to right fielder George Springer.,0,4,1,,,,,,
529435,2018-03-31,Houston Astros,Texas Rangers,9,3,4,bottom,32,2,1,2,425783,Shin-Soo Choo,L,621121,Lance McCullers Jr.,R,Groundout,field_out,"Shin-Soo Choo grounds out, pitcher Lance McCullers to third baseman Alex Bregman to first baseman J. D. Davis. Nomar Mazara to 2nd.",0,4,1,608577.0,Nomar Mazara,1B,2B,False,
529435,2018-03-31,Houston Astros,Texas Rangers,9,3,4,bottom,33,0,1,3,596059,Rougned Odor,L,621121,Lance McCullers Jr.,R,Groundout,field_out,"Rougned Odor grounds out, first baseman J. D. Davis to pitcher Lance McCullers.",0,4,1,,,,,,
529435,2018-03-31,Houston Astros,Texas Rangers,9,3,5,top,34,1,0,1,608324,Alex Bregman,R,643320,Nick Gardewine,R,Lineout,field_out,Alex Bregman lines out to center fielder Carlos Tocci.,0,4,1,,,,,,
529435,2018-03-31,Houston Astros,Texas Rangers,9,3,5,top,35,0,1,1,514888,Jose Altuve,R,643320,Nick Gardewine,R,Single,single,Jose Altuve singles on a line drive to left fielder Drew Robinson.,0,4,1,,,,,,
529435,2018-03-31,Houston Astros,Texas Rangers,9,3,5,top,36,0,2,1,621043,Carlos Correa,R,643320,Nick Gardewine,R,Single,single,Carlos Correa singles on a ground ball to right fielder Nomar Mazara. Jose Altuve to 3rd.,0,4,1,514888.0,Jose Altuve,1B,2B,False,
529435,2018-03-31,Houston Astros,Texas Rangers,9,3,5,top,36,0,2,1,621043,Carlos Correa,R,643320,Nick Gardewine,R,Single,single,Carlos Correa singles on a ground ball to right fielder Nomar Mazara. Jose Altuve to 3rd.,0,4,1,514888.0,Jose Altuve,2B,3B,False,
529435,2018-03-31,Houston Astros,Texas Rangers,9,3,5,top,37,0,2,2,503556,Marwin Gonzalez,L,643320,Nick Gardewine,R,Sac Fly,sac_fly,Marwin Gonzalez out on a sacrifice fly to left fielder Drew Robinson. Jose Altuve scores.,1,5,1,514888.0,Jose Altuve,3B,score,False,
529435,2018-03-31,Houston Astros,Texas Rangers,9,3,5,top,38,1,2,3,594828,Evan Gattis,R,643320,Nick Gardewine,R,Forceout,force_out,"Evan Gattis grounds into a force out, third baseman Adrian Beltre to second baseman Rougned Odor. Carlos Correa out at 2nd. Evan Gattis to 1st.",0,5,1,,,,,,
529435,2018-03-31,Houston Astros,Texas Rangers,9,3,5,bottom,39,0,3,1,518542,Juan Centeno,L,621121,Lance McCullers Jr.,R,Strikeout,strikeout,Juan Centeno called out on strikes.,0,5,1,,,,,,
529435,2018-03-31,Houston Astros,Texas Rangers,9,3,5,bottom,40,2,3,2,592685,Drew Robinson,L,621121,Lance McCullers Jr.,R,Strikeout,strikeout,Drew Robinson strikes out swinging.,0,5,1,,,,,,
529435,2018-03-31,Houston Astros,Texas Rangers,9,3,5,bottom,41,1,3,3,624636,Carlos Tocci,R,621121,Lance McCullers Jr.,R,Strikeout,strikeout,Carlos Tocci strikes out swinging.,0,5,1,,,,,,
529435,2018-03-31,Houston Astros,Texas Rangers,9,3,6,top,42,2,1,1,605204,J.D. Davis,R,445926,Jesse Chavez,R,Flyout,field_out,J.D. Davis flies out to right fielder Nomar Mazara.,0,5,1,,,,,,
529435,2018-03-31,Houston Astros,Texas Rangers,9,3,6,top,43,2,2,1,435263,Brian McCann,L,445926,Jesse Chavez,R,Single,single,Brian McCann singles on a sharp line drive to right fielder Nomar Mazara.,0,5,1,,,,,,
529435,2018-03-31,Houston Astros,Texas Rangers,9,3,6,top,44,0,1,2,545350,Jake Marisnick,R,445926,Jesse Chavez,R,Forceout,force_out,"Jake Marisnick grounds into a force out, third baseman Adrian Beltre to second baseman Rougned Odor. Brian McCann out at 2nd. Jake Marisnick to 1st.",0,5,1,,,,,,
529435,2018-03-31,Houston Astros,Texas Rangers,9,3,6,top,45,2,1,2,543807,George Springer,R,445926,Jesse Chavez,R,Double,double,George Springer doubles (1) on a sharp line drive to left fielder Drew Robinson. Jake Marisnick scores.,1,6,1,545350.0,Jake Marisnick,1B,3B,False,
529435,2018-03-31,Houston Astros,Texas Rangers,9,3,6,top,45,2,1,2,543807,George Springer,R,445926,Jesse Chavez,R,Double,double,George Springer doubles (1) on a sharp line drive to left fielder Drew Robinson. Jake Marisnick scores.,1,6,1,545350.0,Jake Marisnick,3B,score,False,
529435,2018-03-31,Houston Astros,Texas Rangers,9,3,6,top,46,0,0,3,608324,Alex Bregman,R,445926,Jesse Chavez,R,Groundout,field_out,"Alex Bregman grounds out, third baseman Adrian Beltre to first baseman Joey Gallo.",0,6,1,,,,,,
529435,2018-03-31,Houston Astros,Texas Rangers,9,3,6,bottom,47,2,2,0,462101,Elvis Andrus,R,621121,Lance McCullers Jr.,R,Single,single,"Elvis Andrus singles on a ground ball to shortstop Carlos Correa, deflected by pitcher Lance McCullers.",0,6,1,,,,,,
529435,2018-03-31,Houston Astros,Texas Rangers,9,3,6,bottom,48,2,3,1,608336,Joey Gallo,L,621121,Lance McCullers Jr.,R,Strikeout,strikeout,Joey Gallo strikes out swinging.,0,6,1,,,,,,
529435,2018-03-31,Houston Astros,Texas Rangers,9,3,6,bottom,49,0,1,1,134181,Adrian Beltré,R,621121,Lance McCullers Jr.,R,Double,double,Adrian Beltre doubles (2) on a ground ball to left fielder Marwin Gonzalez. Elvis Andrus scores.,1,6,2,462101.0,Elvis Andrus,1B,3B,False,
529435,2018-03-31,Houston Astros,Texas Rangers,9,3,6,bottom,49,0,1,1,134181,Adrian Beltré,R,621121,Lance McCullers Jr.,R,Double,double,Adrian Beltre doubles (2) on a ground ball to left fielder Marwin Gonzalez. Elvis Andrus scores.,1,6,2,462101.0,Elvis Andrus,3B,score,False,
529435,2018-03-31,Houston Astros,Texas Rangers,9,3,6,bottom,50,1,0,2,608577,Nomar Mazara,L,501789,Will Harris,R,Lineout,field_out,Nomar Mazara lines out to center fielder Jake Marisnick.,0,6,2,,,,,,
529435,2018-03-31,Houston Astros,Texas Rangers,9,3,6,bottom,51,1,3,3,425783,Shin-Soo Choo,L,501789,Will Harris,R,Strikeout,strikeout,Shin-Soo Choo strikes out swinging.,0,6,2,,,,,,
529435,2018-03-31,Houston Astros,Texas Rangers,9,3,7,top,52,1,2,0,514888,Jose Altuve,R,445926,Jesse Chavez,R,Single,single,Jose Altuve singles on a line drive to center fielder Carlos Tocci.,0,6,2,,,,,,
529435,2018-03-31,Houston Astros,Texas Rangers,9,3,7,top,53,0,2,0,621043,Carlos Correa,R,445926,Jesse Chavez,R,Home Run,home_run,Carlos Correa homers (1) on a line drive to left center field. Jose Altuve scores.,2,8,2,514888.0,Jose Altuve,1B,score,False,
529435,2018-03-31,Houston Astros,Texas Rangers,9,3,7,top,54,1,2,1,503556,Marwin Gonzalez,L,445926,Jesse Chavez,R,Flyout,field_out,Marwin Gonzalez flies out to left fielder Drew Robinson.,0,8,2,,,,,,
529435,2018-03-31,Houston Astros,Texas Rangers,9,3,7,top,55,1,3,2,594828,Evan Gattis,R,445926,Jesse Chavez,R,Strikeout,strikeout,Evan Gattis strikes out swinging.,0,8,2,,,,,,
529435,2018-03-31,Houston Astros,Texas Rangers,9,3,7,top,56,2,0,3,605204,J.D. Davis,R,445926,Jesse Chavez,R,Groundout,field_out,"J.D. Davis grounds out, shortstop Elvis Andrus to first baseman Joey Gallo.",0,8,2,,,,,,
529435,2018-03-31,Houston Astros,Texas Rangers,9,3,7,bottom,57,0,2,1,596059,Rougned Odor,L,448609,Tony Sipp,L,Groundout,field_out,"Rougned Odor grounds out, second baseman Jose Altuve to first baseman J. D. Davis.",0,8,2,,,,,,
529435,2018-03-31,Houston Astros,Texas Rangers,9,3,7,bottom,58,1,0,2,518542,Juan Centeno,L,448609,Tony Sipp,L,Groundout,field_out,Juan Centeno grounds out to first baseman J. D. Davis.,0,8,2,,,,,,
529435,2018-03-31,Houston Astros,Texas Rangers,9,3,7,bottom,59,2,3,3,592685,Drew Robinson,L,448609,Tony Sipp,L,Strikeout,strikeout,Drew Robinson called out on strikes.,0,8,2,,,,,,
529435,2018-03-31,Houston Astros,Texas Rangers,9,3,8,top,60,4,2,0,435263,Brian McCann,L,518617,Jake Diekman,L,Walk,walk,Brian McCann walks.,0,8,2,,,,,,
529435,2018-03-31,Houston Astros,Texas Rangers,9,3,8,top,61,0,3,1,545350,Jake Marisnick,R,518617,Jake Diekman,L,Strikeout,strikeout,Jake Marisnick strikes out swinging.,0,8,2,,,,,,
529435,2018-03-31,Houston Astros,Texas Rangers,9,3,8,top,62,4,0,1,543807,George Springer,R,518617,Jake Diekman,L,Walk,walk,George Springer walks. Brian McCann to 2nd.,0,8,2,435263.0,Brian McCann,1B,2B,False,
529435,2018-03-31,Houston Astros,Texas Rangers,9,3,8,top,63,3,1,2,608324,Alex Bregman,R,600917,José Leclerc,R,Flyout,field_out,Alex Bregman flies out to center fielder Carlos Tocci.,0,8,2,,,,,,
529435,2018-03-31,Houston Astros,Texas Rangers,9,3,8,top,64,2,2,2,514888,Jose Altuve,R,600917,José Leclerc,R,Single,single,Jose Altuve singles on a line drive to center fielder Carlos Tocci. Brian McCann scores. George Springer to 3rd.,1,9,2,435263.0,Brian McCann,2B,3B,False,
529435,2018-03-31,Houston Astros,Texas Rangers,9,3,8,top,64,2,2,2,514888,Jose Altuve,R,600917,José Leclerc,R,Single,single,Jose Altuve singles on a line drive to center fielder Carlos Tocci. Brian McCann scores. George Springer to 3rd.,1,9,2,435263.0,Brian McCann,3B,score,False,
529435,2018-03-31,Houston Astros,Texas Rangers,9,3,8,top,64,2,2,2,514888,Jose Altuve,R,600917,José Leclerc,R,Single,single,Jose Altuve singles on a line drive to center fielder Carlos Tocci. Brian McCann scores. George Springer to 3rd.,1,9,2,543807.0,George Springer,1B,2B,False,
529435,2018-03-31,Houston Astros,Texas Rangers,9,3,8,top,64,2,2,2,514888,Jose Altuve,R,600917,José Leclerc,R,Single,single,Jose Altuve singles on a line drive to center fielder Carlos Tocci. Brian McCann scores. George Springer to 3rd.,1,9,2,543807.0,George Springer,2B,3B,False,
529435,2018-03-31,Houston Astros,Texas Rangers,9,3,8,top,65,3,1,3,621043,Carlos Correa,R,600917,José Leclerc,R,Lineout,field_out,Carlos Correa lines out to center fielder Carlos Tocci.,0,9,2,,,,,,
529435,2018-03-31,Houston Astros,Texas Rangers,9,3,8,bottom,66,2,1,1,624636,Carlos Tocci,R,448609,Tony Sipp,L,Lineout,field_out,Carlos Tocci lines out to second baseman Marwin Gonzalez.,0,9,2,,,,,,
529435,2018-03-31,Houston Astros,Texas Rangers,9,3,8,bottom,67,4,1,1,462101,Elvis Andrus,R,448609,Tony Sipp,L,Walk,walk,Elvis Andrus walks.,0,9,2,,,,,,
529435,2018-03-31,Houston Astros,Texas Rangers,9,3,8,bottom,68,0,3,2,608336,Joey Gallo,L,448609,Tony Sipp,L,Strikeout,strikeout,Joey Gallo strikes out swinging.,0,9,2,,,,,,
529435,2018-03-31,Houston Astros,Texas Rangers,9,3,8,bottom,69,4,1,2,595777,Jurickson Profar,R,448609,Tony Sipp,L,Walk,walk,Jurickson Profar walks. Elvis Andrus to 2nd.,0,9,2,462101.0,Elvis Andrus,1B,2B,False,
529435,2018-03-31,Houston Astros,Texas Rangers,9,3,8,bottom,70,2,2,2,608577,Nomar Mazara,L,448609,Tony Sipp,L,Single,single,Nomar Mazara singles on a line drive to left fielder Derek Fisher. Elvis Andrus scores. Jurickson Profar to 2nd.,1,9,3,462101.0,Elvis Andrus,2B,3B,False,
529435,2018-03-31,Houston Astros,Texas Rangers,9,3,8,bottom,70,2,2,2,608577,Nomar Mazara,L,448609,Tony Sipp,L,Single,single,Nomar Mazara singles on a line drive to left fielder Derek Fisher. Elvis Andrus scores. Jurickson Profar to 2nd.,1,9,3,462101.0,Elvis Andrus,3B,score,False,
529435,2018-03-31,Houston Astros,Texas Rangers,9,3,8,bottom,70,2,2,2,608577,Nomar Mazara,L,448609,Tony Sipp,L,Single,single,Nomar Mazara singles on a line drive to left fielder Derek Fisher. Elvis Andrus scores. Jurickson Profar to 2nd.,1,9,3,595777.0,Jurickson Profar,1B,2B,False,
529435,2018-03-31,Houston Astros,Texas Rangers,9,3,8,bottom,71,2,2,3,425783,Shin-Soo Choo,L,543521,Collin McHugh,R,Flyout,field_out,Shin-Soo Choo flies out to left fielder Derek Fisher.,0,9,3,,,,,,
529435,2018-03-31,Houston Astros,Texas Rangers,9,3,9,top,72,4,2,0,503556,Marwin Gonzalez,L,456713,Matt Bush,R,Walk,walk,Marwin Gonzalez walks.,0,9,3,,,,,,
529435,2018-03-31,Houston Astros,Texas Rangers,9,3,9,top,73,4,2,0,594828,Evan Gattis,R,456713,Matt Bush,R,Walk,walk,Evan Gattis walks.,0,9,3,503556.0,Marwin Gonzalez,1B,2B,False,
529435,2018-03-31,Houston Astros,Texas Rangers,9,3,9,top,74,1,3,1,605204,J.D. Davis,R,456713,Matt Bush,R,Strikeout,strikeout,J.D. Davis called out on strikes.,0,9,3,,,,,,
529435,2018-03-31,Houston Astros,Texas Rangers,9,3,9,top,75,1,1,2,435263,Brian McCann,L,456713,Matt Bush,R,Flyout,field_out,Brian McCann flies out to left fielder Drew Robinson.,0,9,3,,,,,,
529435,2018-03-31,Houston Astros,Texas Rangers,9,3,9,top,76,0,0,3,545350,Jake Marisnick,R,456713,Matt Bush,R,Pop Out,field_out,Jake Marisnick pops out to second baseman Rougned Odor.,0,9,3,,,,,,
529435,2018-03-31,Houston Astros,Texas Rangers,9,3,9,bottom,77,1,0,1,596059,Rougned Odor,L,543521,Collin McHugh,R,Groundout,field_out,"Rougned Odor grounds out, shortstop Carlos Correa to first baseman J. D. Davis.",0,9,3,,,,,,
529435,2018-03-31,Houston Astros,Texas Rangers,9,3,9,bottom,78,2,2,2,518542,Juan Centeno,L,543521,Collin McHugh,R,Lineout,field_out,Juan Centeno lines out to center fielder Jake Marisnick.,0,9,3,,,,,,
529435,2018-03-31,Houston Astros,Texas Rangers,9,3,9,bottom,79,4,2,2,592685,Drew Robinson,L,543521,Collin McHugh,R,Walk,walk,Drew Robinson walks.,0,9,3,,,,,,
529435,2018-03-31,Houston Astros,Texas Rangers,9,3,9,bottom,80,1,1,3,624636,Carlos Tocci,R,543521,Collin McHugh,R,Groundout,field_out,"Carlos Tocci grounds out, shortstop Carlos Correa to first baseman J. D. Davis.",0,9,3,,,,,,
529439,2018-03-31,New York Yankees,Toronto Blue Jays,3,5,1,top,0,4,2,0,435522,Neil Walker,L,462136,Marco Estrada,R,Walk,walk,Neil Walker walks.,0,0,0,,,,,,
529439,2018-03-31,New York Yankees,Toronto Blue Jays,3,5,1,top,1,0,2,2,592450,Aaron Judge,R,462136,Marco Estrada,R,Grounded Into DP,grounded_into_double_play,"Aaron Judge grounds into a double play, third baseman Yangervis Solarte to second baseman Gift Ngoepe to first baseman Justin Smoak. Neil Walker out at 2nd. Aaron Judge out at 1st.",0,0,0,,,,,,
529439,2018-03-31,New York Yankees,Toronto Blue Jays,3,5,1,top,2,2,1,2,519317,Giancarlo Stanton,R,462136,Marco Estrada,R,Double,double,Giancarlo Stanton doubles (2) on a sharp line drive to left fielder Steve Pearce.,0,0,0,,,,,,
529439,2018-03-31,New York Yankees,Toronto Blue Jays,3,5,1,top,3,1,0,3,544369,Didi Gregorius,L,462136,Marco Estrada,R,Groundout,field_out,"Didi Gregorius grounds out softly, third baseman Yangervis Solarte to first baseman Justin Smoak.",0,0,0,,,,,,
529439,2018-03-31,New York Yankees,Toronto Blue Jays,3,5,1,bottom,4,1,2,1,456665,Steve Pearce,R,282332,CC Sabathia,L,Lineout,field_out,Steve Pearce lines out to shortstop Didi Gregorius.,0,0,0,,,,,,
529439,2018-03-31,New York Yankees,Toronto Blue Jays,3,5,1,bottom,5,2,1,1,518626,Josh Donaldson,R,282332,CC Sabathia,L,Double,double,Josh Donaldson doubles (1) on a fly ball to center fielder Aaron Judge.,0,0,0,,,,,,
529439,2018-03-31,New York Yankees,Toronto Blue Jays,3,5,1,bottom,6,0,0,1,475253,Justin Smoak,R,282332,CC Sabathia,L,Single,single,Justin Smoak singles on a line drive to left fielder Billy McKinney. Josh Donaldson scores.,1,0,1,518626.0,Josh Donaldson,2B,score,False,
529439,2018-03-31,New York Yankees,Toronto Blue Jays,3,5,1,bottom,7,0,0,2,500208,Yangervis Solarte,R,282332,CC Sabathia,L,Flyout,field_out,Yangervis Solarte flies out to center fielder Aaron Judge.,0,0,1,,,,,,
529439,2018-03-31,New York Yankees,Toronto Blue Jays,3,5,1,bottom,8,0,2,2,545341,Randal Grichuk,R,282332,CC Sabathia,L,Single,single,Randal Grichuk singles on a line drive to left fielder Brett Gardner. Justin Smoak to 2nd.,0,0,1,475253.0,Justin Smoak,1B,2B,False,
529439,2018-03-31,New York Yankees,Toronto Blue Jays,3,5,1,bottom,9,2,1,3,607680,Kevin Pillar,R,282332,CC Sabathia,L,Groundout,field_out,"Kevin Pillar grounds out, shortstop Didi Gregorius to first baseman Tyler Austin.",0,0,1,,,,,,
529439,2018-03-31,New York Yankees,Toronto Blue Jays,3,5,2,top,10,2,0,1,596142,Gary Sánchez,R,462136,Marco Estrada,R,Groundout,field_out,"Gary Sanchez grounds out, third baseman Yangervis Solarte to first baseman Justin Smoak.",0,0,1,,,,,,
529439,2018-03-31,New York Yankees,Toronto Blue Jays,3,5,2,top,11,1,2,2,592273,Brandon Drury,R,462136,Marco Estrada,R,Lineout,field_out,Brandon Drury lines out to center fielder Kevin Pillar.,0,0,1,,,,,,
529439,2018-03-31,New York Yankees,Toronto Blue Jays,3,5,2,top,12,4,0,2,458731,Brett Gardner,L,462136,Marco Estrada,R,Walk,walk,Brett Gardner walks.,0,0,1,,,,,,
529439,2018-03-31,New York Yankees,Toronto Blue Jays,3,5,2,top,13,0,3,3,592122,Tyler Austin,R,462136,Marco Estrada,R,Strikeout,strikeout,Tyler Austin strikes out swinging.,0,0,1,,,,,,
529439,2018-03-31,New York Yankees,Toronto Blue Jays,3,5,2,bottom,14,0,0,1,649557,Aledmys Díaz,R,282332,CC Sabathia,L,Lineout,field_out,Aledmys Diaz lines out sharply to right fielder Giancarlo Stanton.,0,0,1,,,,,,
529439,2018-03-31,New York Yankees,Toronto Blue Jays,3,5,2,bottom,15,0,2,2,571912,Luke Maile,R,282332,CC Sabathia,L,Groundout,field_out,"Luke Maile grounds out, third baseman Brandon Drury to first baseman Tyler Austin.",0,0,1,,,,,,
529439,2018-03-31,New York Yankees,Toronto Blue Jays,3,5,2,bottom,16,0,0,3,547912,Gift Ngoepe,R,282332,CC Sabathia,L,Groundout,field_out,"Gift Ngoepe grounds out, second baseman Tyler Wade to first baseman Tyler Austin.",0,0,1,,,,,,
529439,2018-03-31,New York Yankees,Toronto Blue Jays,3,5,3,top,17,1,3,1,642180,Tyler Wade,L,462136,Marco Estrada,R,Strikeout,strikeout,Tyler Wade strikes out swinging.,0,0,1,,,,,,
529439,2018-03-31,New York Yankees,Toronto Blue Jays,3,5,3,top,18,1,2,2,435522,Neil Walker,L,462136,Marco Estrada,R,Groundout,field_out,"Neil Walker grounds out, pitcher Marco Estrada to first baseman Justin Smoak.",0,0,1,,,,,,
529439,2018-03-31,New York Yankees,Toronto Blue Jays,3,5,3,top,19,1,2,3,592450,Aaron Judge,R,462136,Marco Estrada,R,Pop Out,field_out,Aaron Judge pops out to first baseman Justin Smoak in foul territory.,0,0,1,,,,,,
529439,2018-03-31,New York Yankees,Toronto Blue Jays,3,5,3,bottom,20,1,2,0,456665,Steve Pearce,R,282332,CC Sabathia,L,Field Error,field_error,Steve Pearce reaches on a throwing error by third baseman Brandon Drury.,0,0,1,,,,,,
529439,2018-03-31,New York Yankees,Toronto Blue Jays,3,5,3,bottom,21,1,3,1,518626,Josh Donaldson,R,282332,CC Sabathia,L,Strikeout,strikeout,Josh Donaldson strikes out swinging.,0,0,1,,,,,,
529439,2018-03-31,New York Yankees,Toronto Blue Jays,3,5,3,bottom,22,1,1,1,475253,Justin Smoak,R,282332,CC Sabathia,L,Double,double,Justin Smoak doubles (2) on a ground ball to left fielder Brett Gardner. Steve Pearce scores.,1,0,2,456665.0,Steve Pearce,1B,3B,False,
529439,2018-03-31,New York Yankees,Toronto Blue Jays,3,5,3,bottom,22,1,1,1,475253,Justin Smoak,R,282332,CC Sabathia,L,Double,double,Justin Smoak doubles (2) on a ground ball to left fielder Brett Gardner. Steve Pearce scores.,1,0,2,456665.0,Steve Pearce,3B,score,False,
529439,2018-03-31,New York Yankees,Toronto Blue Jays,3,5,3,bottom,23,1,1,2,500208,Yangervis Solarte,R,282332,CC Sabathia,L,Pop Out,field_out,Yangervis Solarte pops out to second baseman Tyler Wade.,0,0,2,,,,,,
529439,2018-03-31,New York Yankees,Toronto Blue Jays,3,5,3,bottom,24,4,1,2,545341,Randal Grichuk,R,282332,CC Sabathia,L,Walk,walk,Randal Grichuk walks.,0,0,2,,,,,,
529439,2018-03-31,New York Yankees,Toronto Blue Jays,3,5,3,bottom,25,3,1,3,607680,Kevin Pillar,R,282332,CC Sabathia,L,Groundout,field_out,"Kevin Pillar grounds out softly, pitcher CC Sabathia to first baseman Tyler Austin.",0,0,2,,,,,,
529439,2018-03-31,New York Yankees,Toronto Blue Jays,3,5,4,top,26,3,0,1,519317,Giancarlo Stanton,R,462136,Marco Estrada,R,Groundout,field_out,Giancarlo Stanton grounds out softly to first baseman Justin Smoak.,0,0,2,,,,,,
529439,2018-03-31,New York Yankees,Toronto Blue Jays,3,5,4,top,27,1,2,2,544369,Didi Gregorius,L,462136,Marco Estrada,R,Groundout,field_out,"Didi Gregorius grounds out, shortstop Aledmys Diaz to first baseman Justin Smoak.",0,0,2,,,,,,
529439,2018-03-31,New York Yankees,Toronto Blue Jays,3,5,4,top,28,0,0,3,596142,Gary Sánchez,R,462136,Marco Estrada,R,Pop Out,field_out,Gary Sanchez pops out to first baseman Justin Smoak.,0,0,2,,,,,,
529439,2018-03-31,New York Yankees,Toronto Blue Jays,3,5,4,bottom,29,0,3,1,649557,Aledmys Díaz,R,282332,CC Sabathia,L,Strikeout,strikeout,Aledmys Diaz strikes out swinging.,0,0,2,,,,,,
529439,2018-03-31,New York Yankees,Toronto Blue Jays,3,5,4,bottom,30,3,2,2,571912,Luke Maile,R,282332,CC Sabathia,L,Groundout,field_out,"Luke Maile grounds out, shortstop Didi Gregorius to first baseman Tyler Austin.",0,0,2,,,,,,
529439,2018-03-31,New York Yankees,Toronto Blue Jays,3,5,4,bottom,31,2,3,3,547912,Gift Ngoepe,R,282332,CC Sabathia,L,Strikeout,strikeout,Gift Ngoepe called out on strikes.,0,0,2,,,,,,
529439,2018-03-31,New York Yankees,Toronto Blue Jays,3,5,5,top,32,4,2,0,592273,Brandon Drury,R,462136,Marco Estrada,R,Walk,walk,Brandon Drury walks.,0,0,2,,,,,,
529439,2018-03-31,New York Yankees,Toronto Blue Jays,3,5,5,top,33,1,0,1,458731,Brett Gardner,L,462136,Marco Estrada,R,Flyout,field_out,Brett Gardner flies out to right fielder Randal Grichuk.,0,0,2,,,,,,
529439,2018-03-31,New York Yankees,Toronto Blue Jays,3,5,5,top,34,0,0,1,592122,Tyler Austin,R,462136,Marco Estrada,R,Home Run,home_run,Tyler Austin homers (1) on a fly ball to left center field. Brandon Drury scores.,2,2,2,592273.0,Brandon Drury,1B,score,False,
529439,2018-03-31,New York Yankees,Toronto Blue Jays,3,5,5,top,35,0,0,2,642180,Tyler Wade,L,462136,Marco Estrada,R,Flyout,field_out,Tyler Wade flies out to center fielder Kevin Pillar.,0,2,2,,,,,,
529439,2018-03-31,New York Yankees,Toronto Blue Jays,3,5,5,top,36,0,0,3,435522,Neil Walker,L,462136,Marco Estrada,R,Flyout,field_out,Neil Walker flies out to center fielder Kevin Pillar.,0,2,2,,,,,,
529439,2018-03-31,New York Yankees,Toronto Blue Jays,3,5,5,bottom,37,2,3,1,456665,Steve Pearce,R,282332,CC Sabathia,L,Strikeout,strikeout,Steve Pearce strikes out swinging.,0,2,2,,,,,,
529439,2018-03-31,New York Yankees,Toronto Blue Jays,3,5,5,bottom,38,4,2,1,518626,Josh Donaldson,R,282332,CC Sabathia,L,Walk,walk,Josh Donaldson walks.,0,2,2,,,,,,
529439,2018-03-31,New York Yankees,Toronto Blue Jays,3,5,5,bottom,39,1,2,1,475253,Justin Smoak,R,282332,CC Sabathia,L,Single,single,Justin Smoak singles on a soft line drive to right fielder Giancarlo Stanton. Josh Donaldson to 2nd.,0,2,2,518626.0,Josh Donaldson,1B,2B,False,
529439,2018-03-31,New York Yankees,Toronto Blue Jays,3,5,5,bottom,40,2,2,3,500208,Yangervis Solarte,R,282332,CC Sabathia,L,Grounded Into DP,grounded_into_double_play,"Yangervis Solarte grounds into a double play, third baseman Brandon Drury to second baseman Tyler Wade to first baseman Tyler Austin. Justin Smoak out at 2nd. Yangervis Solarte out at 1st.",0,2,2,,,,,,
529439,2018-03-31,New York Yankees,Toronto Blue Jays,3,5,6,top,41,0,1,1,592450,Aaron Judge,R,462136,Marco Estrada,R,Pop Out,field_out,Aaron Judge pops out to third baseman Yangervis Solarte.,0,2,2,,,,,,
529439,2018-03-31,New York Yankees,Toronto Blue Jays,3,5,6,top,42,2,2,2,519317,Giancarlo Stanton,R,462136,Marco Estrada,R,Groundout,field_out,"Giancarlo Stanton grounds out softly, catcher Luke Maile to first baseman Justin Smoak.",0,2,2,,,,,,
529439,2018-03-31,New York Yankees,Toronto Blue Jays,3,5,6,top,43,0,1,2,544369,Didi Gregorius,L,462136,Marco Estrada,R,Double,double,Didi Gregorius doubles (2) on a ground ball to right fielder Randal Grichuk.,0,2,2,,,,,,
529439,2018-03-31,New York Yankees,Toronto Blue Jays,3,5,6,top,44,0,1,3,596142,Gary Sánchez,R,462136,Marco Estrada,R,Flyout,field_out,Gary Sanchez flies out to right fielder Randal Grichuk in foul territory.,0,2,2,,,,,,
529439,2018-03-31,New York Yankees,Toronto Blue Jays,3,5,6,bottom,45,1,0,1,545341,Randal Grichuk,R,476589,Adam Warren,R,Groundout,field_out,"Randal Grichuk grounds out, third baseman Brandon Drury to first baseman Tyler Austin.",0,2,2,,,,,,
529439,2018-03-31,New York Yankees,Toronto Blue Jays,3,5,6,bottom,46,4,0,1,607680,Kevin Pillar,R,476589,Adam Warren,R,Walk,walk,Kevin Pillar walks.,0,2,2,,,,,,
529439,2018-03-31,New York Yankees,Toronto Blue Jays,3,5,6,bottom,47,0,0,2,649557,Aledmys Díaz,R,476589,Adam Warren,R,Groundout,field_out,"Aledmys Diaz grounds out sharply, pitcher Adam Warren to first baseman Tyler Austin. Kevin Pillar to 2nd.",0,2,2,607680.0,Kevin Pillar,1B,2B,False,
529439,2018-03-31,New York Yankees,Toronto Blue Jays,3,5,6,bottom,48,1,1,2,571912,Luke Maile,R,656547,Jonathan Holder,R,Single,single,Luke Maile singles on a line drive to left fielder Brett Gardner. Kevin Pillar scores.,1,2,3,607680.0,Kevin Pillar,2B,score,False,
529439,2018-03-31,New York Yankees,Toronto Blue Jays,3,5,6,bottom,49,1,3,3,547912,Gift Ngoepe,R,656547,Jonathan Holder,R,Strikeout,strikeout,Gift Ngoepe called out on strikes.,0,2,3,,,,,,
529439,2018-03-31,New York Yankees,Toronto Blue Jays,3,5,7,top,50,3,2,1,592273,Brandon Drury,R,462136,Marco Estrada,R,Flyout,field_out,Brandon Drury flies out to right fielder Randal Grichuk.,0,2,3,,,,,,
529439,2018-03-31,New York Yankees,Toronto Blue Jays,3,5,7,top,51,0,2,2,458731,Brett Gardner,L,462136,Marco Estrada,R,Pop Out,field_out,Brett Gardner pops out to shortstop Aledmys Diaz.,0,2,3,,,,,,
529439,2018-03-31,New York Yankees,Toronto Blue Jays,3,5,7,top,52,2,0,2,592122,Tyler Austin,R,462136,Marco Estrada,R,Home Run,home_run,Tyler Austin homers (2) on a fly ball to left field.,1,3,3,,,,,,
529439,2018-03-31,New York Yankees,Toronto Blue Jays,3,5,7,top,53,1,1,3,642180,Tyler Wade,L,462136,Marco Estrada,R,Groundout,field_out,Tyler Wade grounds out to first baseman Justin Smoak.,0,3,3,,,,,,
