game_id,game_date,away_team,home_team,away_score,home_score,inning,half_inning,at_bat_index,balls,strikes,outs,batter_id,batter_name,batter_side,pitcher_id,pitcher_name,pitcher_hand,event,event_type,description,rbi,away_score_after,home_score_after,runner_id,runner_name,start_base,end_base,is_out,out_number
529418,2018-03-29,San Francisco Giants,Los Angeles Dodgers,1,0,1,bottom,4,3,3,1,621035,Chris Taylor,R,621389,Ty Blach,L,Strikeout,strikeout,Chris Taylor called out on strikes.,0,0,0,,,,,,
529418,2018-03-29,San Francisco Giants,Los Angeles Dodgers,1,0,1,bottom,5,1,3,2,608369,Corey Seager,L,621389,Ty Blach,L,Strikeout,strikeout,Corey Seager called out on strikes.,0,0,0,,,,,,
529418,2018-03-29,San Francisco Giants,Los Angeles Dodgers,1,0,1,bottom,6,4,1,2,624577,Yasiel Puig,R,621389,Ty Blach,L,Walk,walk,Yasiel Puig walks.,0,0,0,,,,,,
529418,2018-03-29,San Francisco Giants,Los Angeles Dodgers,1,0,1,bottom,7,3,2,3,571771,Enrique Hernández,R,621389,Ty Blach,L,Groundout,field_out,"Enrique Hernandez grounds out, third baseman Evan Longoria to first baseman Brandon Belt.",0,0,0,624577.0,Yasiel Puig,1B,2B,False,
529418,2018-03-29,San Francisco Giants,Los Angeles Dodgers,1,0,2,top,8,1,1,1,446334,Evan Longoria,R,477132,Clayton Kershaw,L,Pop Out,field_out,Evan Longoria pops out to second baseman Enrique Hernandez.,0,0,0,,,,,,
529418,2018-03-29,San Francisco Giants,Los Angeles Dodgers,1,0,2,top,9,0,0,1,452254,Hunter Pence,R,477132,Clayton Kershaw,L,Double,double,Hunter Pence doubles (1) on a line drive to left fielder Matt Kemp.,0,0,0,,,,,,
529418,2018-03-29,San Francisco Giants,Los Angeles Dodgers,1,0,2,top,10,2,2,1,474832,Brandon Belt,L,477132,Clayton Kershaw,L,Single,single,Brandon Belt singles on a line drive to right fielder Yasiel Puig. Hunter Pence to 3rd.,0,0,0,452254.0,Hunter Pence,2B,3B,False,
529418,2018-03-29,San Francisco Giants,Los Angeles Dodgers,1,0,2,top,11,0,0,2,543063,Brandon Crawford,L,477132,Clayton Kershaw,L,Pop Out,field_out,Brandon Crawford pops out to third baseman Logan Forsythe in foul territory.,0,0,0,,,,,,
529418,2018-03-29,San Francisco Giants,Los Angeles Dodgers,1,0,2,top,12,2,3,3,621389,Ty Blach,R,477132,Clayton Kershaw,L,Strikeout,strikeout,Ty Blach strikes out on a foul tip.,0,0,0,,,,,,
529418,2018-03-29,San Francisco Giants,Los Angeles Dodgers,1,0,2,bottom,13,1,2,1,641355,Cody Bellinger,L,621389,Ty Blach,L,Groundout,field_out,"Cody Bellinger grounds out, second baseman Joe Panik to first baseman Brandon Belt.",0,0,0,,,,,,
529418,2018-03-29,San Francisco Giants,Los Angeles Dodgers,1,0,2,bottom,14,4,2,1,461314,Matt Kemp,R,621389,Ty Blach,L,Walk,walk,Matt Kemp walks.,0,0,0,,,,,,
529418,2018-03-29,San Francisco Giants,Los Angeles Dodgers,1,0,2,bottom,15,1,1,1,518735,Yasmani Grandal,R,621389,Ty Blach,L,Single,single,Yasmani Grandal singles on a ground ball to center fielder Austin Jackson. Matt Kemp to 2nd.,0,0,0,461314.0,Matt Kemp,1B,2B,False,
529418,2018-03-29,San Francisco Giants,Los Angeles Dodgers,1,0,2,bottom,16,1,2,3,523253,Logan Forsythe,R,621389,Ty Blach,L,Grounded Into DP,grounded_into_double_play,"Logan Forsythe grounds into a double play, second baseman Joe Panik to shortstop Brandon Crawford to first baseman Brandon Belt. Yasmani Grandal out at 2nd. Logan Forsythe out at 1st.",0,0,0,,,,,,
529418,2018-03-29,San Francisco Giants,Los Angeles Dodgers,1,0,3,top,17,0,0,1,457706,Austin Jackson,R,477132,Clayton Kershaw,L,Lineout,field_out,Austin Jackson lines out to shortstop Corey Seager.,0,0,0,,,,,,
529418,2018-03-29,San Francisco Giants,Los Angeles Dodgers,1,0,3,top,18,1,1,2,605412,Joe Panik,L,477132,Clayton Kershaw,L,Groundout,field_out,"Joe Panik grounds out, shortstop Corey Seager to first baseman Cody Bellinger.",0,0,0,,,,,,
529418,2018-03-29,San Francisco Giants,Los Angeles Dodgers,1,0,3,top,19,1,1,3,457705,Andrew McCutchen,R,477132,Clayton Kershaw,L,Pop Out,field_out,Andrew McCutchen pops out to first baseman Cody Bellinger.,0,0,0,,,,,,
529418,2018-03-29,San Francisco Giants,Los Angeles Dodgers,1,0,3,bottom,20,1,2,0,477132,Clayton Kershaw,L,621389,Ty Blach,L,Single,single,Clayton Kershaw singles on a line drive to left fielder Hunter Pence.,0,0,0,,,,,,
529418,2018-03-29,San Francisco Giants,Los Angeles Dodgers,1,0,3,bottom,21,0,1,1,621035,Chris Taylor,R,621389,Ty Blach,L,Forceout,force_out,"Chris Taylor grounds into a force out, second baseman Joe Panik to shortstop Brandon Crawford. Clayton Kershaw out at 2nd. Chris Taylor to 1st.",0,0,0,,,,,,
529418,2018-03-29,San Francisco Giants,Los Angeles Dodgers,1,0,3,bottom,22,1,0,3,608369,Corey Seager,L,621389,Ty Blach,L,Grounded Into DP,grounded_into_double_play,"Corey Seager grounds into a double play, pitcher Ty Blach to shortstop Brandon Crawford to first baseman Brandon Belt. Chris Taylor out at 2nd. Corey Seager out at 1st.",0,0,0,,,,,,
529418,2018-03-29,San Francisco Giants,Los Angeles Dodgers,1,0,4,top,23,4,2,0,457763,Buster Posey,R,477132,Clayton Kershaw,L,Walk,walk,Buster Posey walks.,0,0,0,,,,,,
529418,2018-03-29,San Francisco Giants,Los Angeles Dodgers,1,0,4,top,24,1,3,1,446334,Evan Longoria,R,477132,Clayton Kershaw,L,Strikeout,strikeout,Evan Longoria strikes out swinging.,0,0,0,,,,,,
529418,2018-03-29,San Francisco Giants,Los Angeles Dodgers,1,0,4,top,25,0,0,1,452254,Hunter Pence,R,477132,Clayton Kershaw,L,Single,single,Hunter Pence singles on a line drive to center fielder Chris Taylor. Buster Posey to 3rd.,0,0,0,457763.0,Buster Posey,1B,2B,False,
529418,2018-03-29,San Francisco Giants,Los Angeles Dodgers,1,0,4,top,25,0,0,1,452254,Hunter Pence,R,477132,Clayton Kershaw,L,Single,single,Hunter Pence singles on a line drive to center fielder Chris Taylor. Buster Posey to 3rd.,0,0,0,457763.0,Buster Posey,2B,3B,False,
529418,2018-03-29,San Francisco Giants,Los Angeles Dodgers,1,0,4,top,26,1,3,2,474832,Brandon Belt,L,477132,Clayton Kershaw,L,Strikeout,strikeout,Brandon Belt strikes out swinging.,0,0,0,,,,,,
529418,2018-03-29,San Francisco Giants,Los Angeles Dodgers,1,0,4,top,27,2,2,3,543063,Brandon Crawford,L,477132,Clayton Kershaw,L,Flyout,field_out,Brandon Crawford flies out to right fielder Yasiel Puig.,0,0,0,,,,,,
529418,2018-03-29,San Francisco Giants,Los Angeles Dodgers,1,0,4,bottom,28,1,0,1,624577,Yasiel Puig,R,621389,Ty Blach,L,Lineout,field_out,Yasiel Puig lines out to left fielder Hunter Pence.,0,0,0,,,,,,
529418,2018-03-29,San Francisco Giants,Los Angeles Dodgers,1,0,4,bottom,29,3,1,2,571771,Enrique Hernández,R,621389,Ty Blach,L,Groundout,field_out,"Enrique Hernandez grounds out, third baseman Evan Longoria to first baseman Brandon Belt.",0,0,0,,,,,,
529418,2018-03-29,San Francisco Giants,Los Angeles Dodgers,1,0,4,bottom,30,1,0,3,641355,Cody Bellinger,L,621389,Ty Blach,L,Flyout,field_out,Cody Bellinger flies out sharply to center fielder Austin Jackson.,0,0,0,,,,,,
529418,2018-03-29,San Francisco Giants,Los Angeles Dodgers,1,0,5,top,31,1,3,1,621389,Ty Blach,R,477132,Clayton Kershaw,L,Strikeout,strikeout,Ty Blach strikes out swinging.,0,0,0,,,,,,
529418,2018-03-29,San Francisco Giants,Los Angeles Dodgers,1,0,5,top,32,0,1,2,457706,Austin Jackson,R,477132,Clayton Kershaw,L,Groundout,field_out,"Austin Jackson grounds out, shortstop Corey Seager to first baseman Cody Bellinger.",0,0,0,,,,,,
529418,2018-03-29,San Francisco Giants,Los Angeles Dodgers,1,0,5,top,33,2,2,2,605412,Joe Panik,L,477132,Clayton Kershaw,L,Home Run,home_run,Joe Panik homers (1) on a fly ball to right field.,1,1,0,,,,,,
529418,2018-03-29,San Francisco Giants,Los Angeles Dodgers,1,0,5,top,34,1,0,2,457705,Andrew McCutchen,R,477132,Clayton Kershaw,L,Double,double,Andrew McCutchen doubles (1) on a ground ball to right fielder Yasiel Puig.,0,1,0,,,,,,
529418,2018-03-29,San Francisco Giants,Los Angeles Dodgers,1,0,5,top,35,4,0,2,457763,Buster Posey,R,477132,Clayton Kershaw,L,Walk,walk,Buster Posey walks.,0,1,0,,,,,,
529418,2018-03-29,San Francisco Giants,Los Angeles Dodgers,1,0,5,top,36,2,3,3,446334,Evan Longoria,R,477132,Clayton Kershaw,L,Strikeout,strikeout,Evan Longoria strikes out swinging.,0,1,0,,,,,,
529418,2018-03-29,San Francisco Giants,Los Angeles Dodgers,1,0,5,bottom,37,1,3,1,461314,Matt Kemp,R,621389,Ty Blach,L,Strikeout,strikeout,Matt Kemp strikes out swinging.,0,1,0,,,,,,
529418,2018-03-29,San Francisco Giants,Los Angeles Dodgers,1,0,5,bottom,38,4,2,1,518735,Yasmani Grandal,R,621389,Ty Blach,L,Walk,walk,Yasmani Grandal walks.,0,1,0,,,,,,
529418,2018-03-29,San Francisco Giants,Los Angeles Dodgers,1,0,5,bottom,39,1,1,2,523253,Logan Forsythe,R,621389,Ty Blach,L,Forceout,force_out,"Logan Forsythe grounds into a force out, third baseman Evan Longoria to second baseman Joe Panik. Yasmani Grandal out at 2nd. Logan Forsythe to 1st.",0,1,0,,,,,,
529418,2018-03-29,San Francisco Giants,Los Angeles Dodgers,1,0,5,bottom,40,1,2,2,477132,Clayton Kershaw,L,621389,Ty Blach,L,Single,single,"Clayton Kershaw singles on a line drive to left fielder Hunter Pence, deflected by shortstop Brandon Crawford. Logan Forsythe to 2nd.",0,1,0,523253.0,Logan Forsythe,1B,2B,False,
529418,2018-03-29,San Francisco Giants,Los Angeles Dodgers,1,0,5,bottom,41,1,1,3,621035,Chris Taylor,R,621389,Ty Blach,L,Forceout,force_out,"Chris Taylor grounds into a force out, shortstop Brandon Crawford to second baseman Joe Panik. Clayton Kershaw out at 2nd. Chris Taylor to 1st.",0,1,0,,,,,,
529418,2018-03-29,San Francisco Giants,Los Angeles Dodgers,1,0,6,top,42,0,3,1,452254,Hunter Pence,R,477132,Clayton Kershaw,L,Strikeout,strikeout,Hunter Pence strikes out swinging.,0,1,0,,,,,,
529418,2018-03-29,San Francisco Giants,Los Angeles Dodgers,1,0,6,top,43,1,1,2,474832,Brandon Belt,L,477132,Clayton Kershaw,L,Groundout,field_out,Brandon Belt grounds out to first baseman Cody Bellinger.,0,1,0,,,,,,
529418,2018-03-29,San Francisco Giants,Los Angeles Dodgers,1,0,6,top,44,0,0,2,543063,Brandon Crawford,L,477132,Clayton Kershaw,L,Single,single,Brandon Crawford singles on a line drive to center fielder Chris Taylor.,0,1,0,,,,,,
529418,2018-03-29,San Francisco Giants,Los Angeles Dodgers,1,0,6,top,45,0,2,3,491676,Gorkys Hernández,R,477132,Clayton Kershaw,L,Groundout,field_out,"Gorkys Hernandez grounds out, pitcher Clayton Kershaw to first baseman Cody Bellinger.",0,1,0,,,,,,
529418,2018-03-29,San Francisco Giants,Los Angeles Dodgers,1,0,6,bottom,46,0,0,1,608369,Corey Seager,L,592612,Josh Osich,L,Flyout,field_out,Corey Seager flies out sharply to center fielder Austin Jackson.,0,1,0,,,,,,
529418,2018-03-29,San Francisco Giants,Los Angeles Dodgers,1,0,6,bottom,47,1,3,2,624577,Yasiel Puig,R,592612,Josh Osich,L,Strikeout,strikeout,Yasiel Puig strikes out swinging.,0,1,0,,,,,,
529418,2018-03-29,San Francisco Giants,Los Angeles Dodgers,1,0,6,bottom,48,4,2,2,571771,Enrique Hernández,R,592612,Josh Osich,L,Walk,walk,Enrique Hernandez walks.,0,1,0,,,,,,
529418,2018-03-29,San Francisco Giants,Los Angeles Dodgers,1,0,6,bottom,49,2,3,3,641355,Cody Bellinger,L,592612,Josh Osich,L,Strikeout,strikeout,Cody Bellinger strikes out swinging.,0,1,0,571771.0,Enrique Hernández,1B,2B,False,
529418,2018-03-29,San Francisco Giants,Los Angeles Dodgers,1,0,7,top,50,0,3,1,457706,Austin Jackson,R,608638,JT Chargois,R,Strikeout,strikeout,Austin Jackson strikes out swinging.,0,1,0,,,,,,
529418,2018-03-29,San Francisco Giants,Los Angeles Dodgers,1,0,7,top,51,2,2,2,605412,Joe Panik,L,608638,JT Chargois,R,Groundout,field_out,"Joe Panik grounds out, second baseman Enrique Hernandez to first baseman Cody Bellinger.",0,1,0,,,,,,
529418,2018-03-29,San Francisco Giants,Los Angeles Dodgers,1,0,7,top,52,0,3,3,457705,Andrew McCutchen,R,608638,JT Chargois,R,Strikeout,strikeout,Andrew McCutchen strikes out swinging.,0,1,0,,,,,,
529418,2018-03-29,San Francisco Giants,Los Angeles Dodgers,1,0,7,bottom,53,0,0,1,461314,Matt Kemp,R,518715,Cory Gearrin,R,Lineout,field_out,Matt Kemp lines out to left fielder Hunter Pence.,0,1,0,,,,,,
529418,2018-03-29,San Francisco Giants,Los Angeles Dodgers,1,0,7,bottom,54,0,0,1,518735,Yasmani Grandal,L,518715,Cory Gearrin,R,Single,single,Yasmani Grandal singles on a line drive to center fielder Austin Jackson.,0,1,0,,,,,,
529418,2018-03-29,San Francisco Giants,Los Angeles Dodgers,1,0,7,bottom,55,1,2,2,523253,Logan Forsythe,R,518715,Cory Gearrin,R,Flyout,field_out,Logan Forsythe flies out to right fielder Andrew McCutchen.,0,1,0,,,,,,
529418,2018-03-29,San Francisco Giants,Los Angeles Dodgers,1,0,7,bottom,56,2,2,2,400284,Chase Utley,L,518715,Cory Gearrin,R,Single,single,Chase Utley singles on a sharp line drive to right fielder Andrew McCutchen. Yasmani Grandal to 3rd.,0,1,0,518735.0,Yasmani Grandal,1B,2B,False,
529418,2018-03-29,San Francisco Giants,Los Angeles Dodgers,1,0,7,bottom,56,2,2,2,400284,Chase Utley,L,518715,Cory Gearrin,R,Single,single,Chase Utley singles on a sharp line drive to right fielder Andrew McCutchen. Yasmani Grandal to 3rd.,0,1,0,518735.0,Yasmani Grandal,2B,3B,False,
529418,2018-03-29,San Francisco Giants,Los Angeles Dodgers,1,0,7,bottom,57,3,3,3,621035,Chris Taylor,R,518715,Cory Gearrin,R,Strikeout,strikeout,Chris Taylor called out on strikes.,0,1,0,400284.0,Chase Utley,1B,2B,False,
529418,2018-03-29,San Francisco Giants,Los Angeles Dodgers,1,0,8,top,58,0,0,1,457763,Buster Posey,R,451661,Josh Fields,R,Groundout,field_out,"Buster Posey grounds out, third baseman Logan Forsythe to first baseman Cody Bellinger.",0,1,0,,,,,,
529418,2018-03-29,San Francisco Giants,Los Angeles Dodgers,1,0,8,top,59,2,3,2,446334,Evan Longoria,R,451661,Josh Fields,R,Strikeout,strikeout,Evan Longoria strikes out swinging.,0,1,0,,,,,,
529418,2018-03-29,San Francisco Giants,Los Angeles Dodgers,1,0,8,top,60,2,2,3,452254,Hunter Pence,R,451661,Josh Fields,R,Groundout,field_out,"Hunter Pence grounds out, second baseman Enrique Hernandez to first baseman Cody Bellinger.",0,1,0,,,,,,
529418,2018-03-29,San Francisco Giants,Los Angeles Dodgers,1,0,8,bottom,61,1,3,1,608369,Corey Seager,L,453265,Tony Watson,L,Strikeout,strikeout,Corey Seager called out on strikes.,0,1,0,,,,,,
529418,2018-03-29,San Francisco Giants,Los Angeles Dodgers,1,0,8,bottom,62,0,3,2,624577,Yasiel Puig,R,453265,Tony Watson,L,Strikeout,strikeout,Yasiel Puig called out on strikes.,0,1,0,,,,,,
529418,2018-03-29,San Francisco Giants,Los Angeles Dodgers,1,0,8,bottom,63,4,1,2,571771,Enrique Hernández,R,453265,Tony Watson,L,Walk,walk,Enrique Hernandez walks.,0,1,0,,,,,,
529418,2018-03-29,San Francisco Giants,Los Angeles Dodgers,1,0,8,bottom,64,1,3,3,641355,Cody Bellinger,L,453265,Tony Watson,L,Strikeout,strikeout,Cody Bellinger strikes out swinging.,0,1,0,,,,,,
529418,2018-03-29,San Francisco Giants,Los Angeles Dodgers,1,0,9,top,65,0,3,1,474832,Brandon Belt,L,571561,Tony Cingrani,L,Strikeout,strikeout,Brandon Belt strikes out swinging.,0,1,0,,,,,,
529418,2018-03-29,San Francisco Giants,Los Angeles Dodgers,1,0,9,top,66,3,2,2,543063,Brandon Crawford,L,571561,Tony Cingrani,L,Lineout,field_out,Brandon Crawford lines out to left fielder Matt Kemp.,0,1,0,,,,,,
529418,2018-03-29,San Francisco Giants,Los Angeles Dodgers,1,0,9,top,67,1,2,3,467055,Pablo Sandoval,R,571561,Tony Cingrani,L,Groundout,field_out,"Pablo Sandoval grounds out, shortstop Corey Seager to first baseman Cody Bellinger.",0,1,0,,,,,,
529418,2018-03-29,San Francisco Giants,Los Angeles Dodgers,1,0,9,bottom,68,2,2,0,461314,Matt Kemp,R,519326,Hunter Strickland,R,Single,single,Matt Kemp singles on a ground ball to center fielder Austin Jackson.,0,1,0,,,,,,
529418,2018-03-29,San Francisco Giants,Los Angeles Dodgers,1,0,9,bottom,69,1,3,1,518735,Yasmani Grandal,L,519326,Hunter Strickland,R,Strikeout,strikeout,Yasmani Grandal strikes out swinging.,0,1,0,,,,,,
529418,2018-03-29,San Francisco Giants,Los Angeles Dodgers,1,0,9,bottom,70,2,1,2,523253,Logan Forsythe,R,519326,Hunter Strickland,R,Pop Out,field_out,Logan Forsythe pops out to third baseman Evan Longoria in foul territory.,0,1,0,,,,,,
529418,2018-03-29,San Francisco Giants,Los Angeles Dodgers,1,0,9,bottom,71,2,2,3,592626,Joc Pederson,L,519326,Hunter Strickland,R,Groundout,field_out,"Joc Pederson grounds out, shortstop Brandon Crawford to first baseman Brandon Belt.",0,1,0,,,,,,
529410,2018-03-29,Colorado Rockies,Arizona Diamondbacks,2,8,1,top,0,2,3,1,453568,Charlie Blackmon,L,571578,Patrick Corbin,L,Strikeout,strikeout,Charlie Blackmon strikes out swinging.,0,0,0,,,,,,
529410,2018-03-29,Colorado Rockies,Arizona Diamondbacks,2,8,1,top,1,2,2,1,518934,DJ LeMahieu,R,571578,Patrick Corbin,L,Home Run,home_run,DJ LeMahieu homers (1) on a fly ball to left center field.,1,1,0,,,,,,
529410,2018-03-29,Colorado Rockies,Arizona Diamondbacks,2,8,1,top,2,2,0,1,571448,Nolan Arenado,R,571578,Patrick Corbin,L,Single,single,Nolan Arenado singles on a sharp line drive to left fielder David Peralta.,0,1,0,,,,,,
529410,2018-03-29,Colorado Rockies,Arizona Diamondbacks,2,8,1,top,3,1,3,2,596115,Trevor Story,R,571578,Patrick Corbin,L,Strikeout,strikeout,Trevor Story called out on strikes.,0,1,0,,,,,,
529410,2018-03-29,Colorado Rockies,Arizona Diamondbacks,2,8,1,top,4,0,3,3,471865,Carlos González,L,571578,Patrick Corbin,L,Strikeout,strikeout,Carlos Gonzalez strikes out swinging.,0,1,0,,,,,,
529410,2018-03-29,Colorado Rockies,Arizona Diamondbacks,2,8,1,bottom,5,3,2,0,444482,David Peralta,L,592351,Jon Gray,R,Single,single,David Peralta singles on a ground ball to right fielder Carlos Gonzalez.,0,1,0,,,,,,
529410,2018-03-29,Colorado Rockies,Arizona Diamondbacks,2,8,1,bottom,6,0,2,0,572041,AJ Pollock,R,592351,Jon Gray,R,Single,single,A.J. Pollock singles on a sharp line drive to left fielder Gerardo Parra. David Peralta to 2nd.,0,1,0,444482.0,David Peralta,1B,2B,False,
529410,2018-03-29,Colorado Rockies,Arizona Diamondbacks,2,8,1,bottom,7,4,2,0,502671,Paul Goldschmidt,R,592351,Jon Gray,R,Walk,walk,Paul Goldschmidt walks. David Peralta to 3rd. A.J. Pollock to 2nd.,0,1,0,444482.0,David Peralta,2B,3B,False,
529410,2018-03-29,Colorado Rockies,Arizona Diamondbacks,2,8,1,bottom,7,4,2,0,502671,Paul Goldschmidt,R,592351,Jon Gray,R,Walk,walk,Paul Goldschmidt walks. David Peralta to 3rd. A.J. Pollock to 2nd.,0,1,0,572041.0,AJ Pollock,1B,2B,False,
529410,2018-03-29,Colorado Rockies,Arizona Diamondbacks,2,8,1,bottom,8,0,0,0,571875,Jake Lamb,L,592351,Jon Gray,R,Double,double,Jake Lamb doubles (1) on a sharp fly ball to right fielder Carlos Gonzalez. David Peralta scores. A.J. Pollock scores. Paul Goldschmidt to 3rd.,2,1,2,444482.0,David Peralta,3B,score,False,
529410,2018-03-29,Colorado Rockies,Arizona Diamondbacks,2,8,1,bottom,8,0,0,0,571875,Jake Lamb,L,592351,Jon Gray,R,Double,double,Jake Lamb doubles (1) on a sharp fly ball to right fielder Carlos Gonzalez. David Peralta scores. A.J. Pollock scores. Paul Goldschmidt to 3rd.,2,1,2,572041.0,AJ Pollock,2B,score,False,
529410,2018-03-29,Colorado Rockies,Arizona Diamondbacks,2,8,1,bottom,8,0,0,0,571875,Jake Lamb,L,592351,Jon Gray,R,Double,double,Jake Lamb doubles (1) on a sharp fly ball to right fielder Carlos Gonzalez. David Peralta scores. A.J. Pollock scores. Paul Goldschmidt to 3rd.,2,1,2,502671.0,Paul Goldschmidt,1B,3B,False,
529410,2018-03-29,Colorado Rockies,Arizona Diamondbacks,2,8,1,bottom,9,1,2,1,606466,Ketel Marte,L,592351,Jon Gray,R,Groundout,field_out,"Ketel Marte grounds out, third baseman Nolan Arenado to first baseman Ian Desmond.",0,1,2,,,,,,
529410,2018-03-29,Colorado Rockies,Arizona Diamondbacks,2,8,1,bottom,10,3,1,2,488671,Alex Avila,L,592351,Jon Gray,R,Groundout,field_out,"Alex Avila grounds out, first baseman Ian Desmond to pitcher Jon Gray. Paul Goldschmidt scores. Jake Lamb to 3rd.",1,1,3,502671.0,Paul Goldschmidt,3B,score,False,
529410,2018-03-29,Colorado Rockies,Arizona Diamondbacks,2,8,1,bottom,10,3,1,2,488671,Alex Avila,L,592351,Jon Gray,R,Groundout,field_out,"Alex Avila grounds out, first baseman Ian Desmond to pitcher Jon Gray. Paul Goldschmidt scores. Jake Lamb to 3rd.",1,1,3,571875.0,Jake Lamb,2B,3B,False,
529410,2018-03-29,Colorado Rockies,Arizona Diamondbacks,2,8,1,bottom,11,1,3,3,605113,Nick Ahmed,R,592351,Jon Gray,R,Strikeout,strikeout,Nick Ahmed strikes out swinging.,0,1,3,,,,,,
529410,2018-03-29,Colorado Rockies,Arizona Diamondbacks,2,8,2,top,12,1,0,1,435622,Ian Desmond,R,571578,Patrick Corbin,L,Groundout,field_out,"Ian Desmond grounds out, shortstop Nick Ahmed to first baseman Paul Goldschmidt.",0,1,3,,,,,,
529410,2018-03-29,Colorado Rockies,Arizona Diamondbacks,2,8,2,top,13,1,0,1,467827,Gerardo Parra,L,571578,Patrick Corbin,L,Single,single,Gerardo Parra singles on a ground ball to center fielder A. J. Pollock.,0,1,3,,,,,,
529410,2018-03-29,Colorado Rockies,Arizona Diamondbacks,2,8,2,top,14,3,3,2,455104,Chris Iannetta,R,571578,Patrick Corbin,L,Strikeout,strikeout,Chris Iannetta strikes out swinging.,0,1,3,,,,,,
529410,2018-03-29,Colorado Rockies,Arizona Diamondbacks,2,8,2,top,15,1,3,3,592351,Jon Gray,R,571578,Patrick Corbin,L,Strikeout,strikeout,Jon Gray strikes out swinging.,0,1,3,,,,,,
529410,2018-03-29,Colorado Rockies,Arizona Diamondbacks,2,8,2,bottom,16,3,1,1,502481,Jarrod Dyson,L,592351,Jon Gray,R,Groundout,field_out,"Jarrod Dyson grounds out, second baseman DJ LeMahieu to first baseman Ian Desmond.",0,1,3,,,,,,
529410,2018-03-29,Colorado Rockies,Arizona Diamondbacks,2,8,2,bottom,17,3,1,2,571578,Patrick Corbin,L,592351,Jon Gray,R,Groundout,field_out,"Patrick Corbin grounds out, second baseman DJ LeMahieu to first baseman Ian Desmond.",0,1,3,,,,,,
529410,2018-03-29,Colorado Rockies,Arizona Diamondbacks,2,8,2,bottom,18,1,1,3,444482,David Peralta,L,592351,Jon Gray,R,Groundout,field_out,"David Peralta grounds out, second baseman DJ LeMahieu to first baseman Ian Desmond.",0,1,3,,,,,,
529410,2018-03-29,Colorado Rockies,Arizona Diamondbacks,2,8,3,top,19,1,0,1,453568,Charlie Blackmon,L,571578,Patrick Corbin,L,Groundout,field_out,"Charlie Blackmon grounds out, first baseman Paul Goldschmidt to pitcher Patrick Corbin.",0,1,3,,,,,,
529410,2018-03-29,Colorado Rockies,Arizona Diamondbacks,2,8,3,top,20,3,2,2,518934,DJ LeMahieu,R,571578,Patrick Corbin,L,Lineout,field_out,DJ LeMahieu lines out sharply to center fielder A. J. Pollock.,0,1,3,,,,,,
529410,2018-03-29,Colorado Rockies,Arizona Diamondbacks,2,8,3,top,21,2,2,3,571448,Nolan Arenado,R,571578,Patrick Corbin,L,Groundout,field_out,"Nolan Arenado grounds out, third baseman Jake Lamb to first baseman Paul Goldschmidt.",0,1,3,,,,,,
529410,2018-03-29,Colorado Rockies,Arizona Diamondbacks,2,8,3,bottom,22,3,3,1,572041,AJ Pollock,R,592351,Jon Gray,R,Strikeout,strikeout,A.J. Pollock strikes out swinging.,0,1,3,,,,,,
529410,2018-03-29,Colorado Rockies,Arizona Diamondbacks,2,8,3,bottom,23,0,0,2,502671,Paul Goldschmidt,R,592351,Jon Gray,R,Flyout,field_out,Paul Goldschmidt flies out to center fielder Charlie Blackmon.,0,1,3,,,,,,
529410,2018-03-29,Colorado Rockies,Arizona Diamondbacks,2,8,3,bottom,24,3,2,3,571875,Jake Lamb,L,592351,Jon Gray,R,Groundout,field_out,Jake Lamb grounds out to first baseman Ian Desmond.,0,1,3,,,,,,
529410,2018-03-29,Colorado Rockies,Arizona Diamondbacks,2,8,4,top,25,2,2,0,596115,Trevor Story,R,571578,Patrick Corbin,L,Single,single,Trevor Story singles on a line drive to right fielder Jarrod Dyson.,0,1,3,,,,,,
529410,2018-03-29,Colorado Rockies,Arizona Diamondbacks,2,8,4,top,26,0,0,1,471865,Carlos González,L,571578,Patrick Corbin,L,Forceout,force_out,"Carlos Gonzalez grounds into a force out, pitcher Patrick Corbin to shortstop Nick Ahmed. Trevor Story out at 2nd. Carlos Gonzalez to 1st.",0,1,3,,,,,,
529410,2018-03-29,Colorado Rockies,Arizona Diamondbacks,2,8,4,top,27,1,3,2,435622,Ian Desmond,R,571578,Patrick Corbin,L,Strikeout,strikeout,Ian Desmond strikes out swinging.,0,1,3,,,,,,
529410,2018-03-29,Colorado Rockies,Arizona Diamondbacks,2,8,4,top,28,2,1,3,467827,Gerardo Parra,L,571578,Patrick Corbin,L,Flyout,field_out,Gerardo Parra flies out to left fielder David Peralta.,0,1,3,,,,,,
529410,2018-03-29,Colorado Rockies,Arizona Diamondbacks,2,8,4,bottom,29,0,1,0,606466,Ketel Marte,L,592351,Jon Gray,R,Single,single,Ketel Marte singles on a ground ball to shortstop Trevor Story.,0,1,3,,,,,,
529410,2018-03-29,Colorado Rockies,Arizona Diamondbacks,2,8,4,bottom,30,0,2,0,488671,Alex Avila,L,592351,Jon Gray,R,Single,single,Alex Avila singles on a line drive to center fielder Charlie Blackmon. Ketel Marte to 2nd.,0,1,3,606466.0,Ketel Marte,1B,2B,False,
529410,2018-03-29,Colorado Rockies,Arizona Diamondbacks,2,8,4,bottom,31,2,3,1,605113,Nick Ahmed,R,592351,Jon Gray,R,Strikeout,strikeout,Nick Ahmed strikes out swinging.,0,1,3,,,,,,
529410,2018-03-29,Colorado Rockies,Arizona Diamondbacks,2,8,4,bottom,32,1,0,2,502481,Jarrod Dyson,L,592351,Jon Gray,R,Flyout,field_out,Jarrod Dyson flies out to left fielder Gerardo Parra.,0,1,3,,,,,,
529410,2018-03-29,Colorado Rockies,Arizona Diamondbacks,2,8,4,bottom,33,0,3,3,571578,Patrick Corbin,L,592351,Jon Gray,R,Strikeout,strikeout,Patrick Corbin called out on strikes.,0,1,3,,,,,,
529410,2018-03-29,Colorado Rockies,Arizona Diamondbacks,2,8,5,top,34,0,2,0,455104,Chris Iannetta,R,571578,Patrick Corbin,L,Single,single,Chris Iannetta singles on a ground ball to center fielder A. J. Pollock.,0,1,3,,,,,,
529410,2018-03-29,Colorado Rockies,Arizona Diamondbacks,2,8,5,top,35,0,0,1,592351,Jon Gray,R,571578,Patrick Corbin,L,Sac Bunt,sac_bunt,"Jon Gray out on a sacrifice bunt, first baseman Paul Goldschmidt to second baseman Ketel Marte. Chris Iannetta to 2nd.",0,1,3,455104.0,Chris Iannetta,1B,2B,False,
529410,2018-03-29,Colorado Rockies,Arizona Diamondbacks,2,8,5,top,36,4,2,1,453568,Charlie Blackmon,L,571578,Patrick Corbin,L,Walk,walk,Charlie Blackmon walks.,0,1,3,,,,,,
529410,2018-03-29,Colorado Rockies,Arizona Diamondbacks,2,8,5,top,37,1,1,3,518934,DJ LeMahieu,R,571578,Patrick Corbin,L,Grounded Into DP,grounded_into_double_play,"DJ LeMahieu grounds into a double play, second baseman Ketel Marte to shortstop Nick Ahmed to first baseman Paul Goldschmidt. Charlie Blackmon out at 2nd. DJ LeMahieu out at 1st.",0,1,3,,,,,,
529410,2018-03-29,Colorado Rockies,Arizona Diamondbacks,2,8,5,bottom,38,1,1,0,444482,David Peralta,L,592351,Jon Gray,R,Single,single,David Peralta singles on a sharp line drive to right fielder Carlos Gonzalez.,0,1,3,,,,,,
