game_id,game_date,away_team,home_team,away_score,home_score,inning,half_inning,at_bat_index,balls,strikes,outs,batter_id,batter_name,batter_side,pitcher_id,pitcher_name,pitcher_hand,event,event_type,description,rbi,away_score_after,home_score_after,runner_id,runner_name,start_base,end_base,is_out,out_number
718774,2023-03-30,New York Mets,Miami Marlins,5,3,7,top,46,0,0,1,502054,Tommy Pham,R,656945,Tanner Scott,L,Groundout,field_out,"Tommy Pham grounds out, third baseman Jean Segura to first baseman Garrett Cooper.",0,3,3,,,,,,
718774,2023-03-30,New York Mets,Miami Marlins,5,3,7,top,47,1,2,1,500871,Eduardo Escobar,R,656945,Tanner Scott,L,Single,single,Eduardo Escobar singles on a sharp line drive to left fielder Bryan De La Cruz.,0,3,3,,,,,,
718774,2023-03-30,New York Mets,Miami Marlins,5,3,7,top,48,4,2,1,553882,Omar Narváez,L,656945,Tanner Scott,L,Walk,walk,Omar Narvaez walks. Eduardo Escobar to 2nd.,0,3,3,500871.0,Eduardo Escobar,1B,2B,False,
718774,2023-03-30,New York Mets,Miami Marlins,5,3,7,top,49,1,1,1,607043,Brandon Nimmo,L,656945,Tanner Scott,L,Double,double,Brandon Nimmo doubles (1) on a sharp line drive to center fielder Jazz Chisholm Jr. Eduardo Escobar scores. Omar Narvaez scores.,2,5,3,553882.0,Omar Narváez,1B,3B,False,
718774,2023-03-30,New York Mets,Miami Marlins,5,3,7,top,49,1,1,1,607043,Brandon Nimmo,L,656945,Tanner Scott,L,Double,double,Brandon Nimmo doubles (1) on a sharp line drive to center fielder Jazz Chisholm Jr. Eduardo Escobar scores. Omar Narvaez scores.,2,5,3,553882.0,Omar Narváez,3B,score,False,
718774,2023-03-30,New York Mets,Miami Marlins,5,3,7,top,49,1,1,1,607043,Brandon Nimmo,L,656945,Tanner Scott,L,Double,double,Brandon Nimmo doubles (1) on a sharp line drive to center fielder Jazz Chisholm Jr. Eduardo Escobar scores. Omar Narvaez scores.,2,5,3,500871.0,Eduardo Escobar,2B,score,False,
718774,2023-03-30,New York Mets,Miami Marlins,5,3,7,top,50,2,2,2,516782,Starling Marte,R,608638,JT Chargois,R,Groundout,field_out,"Starling Marte grounds out, third baseman Jean Segura to first baseman Garrett Cooper.",0,5,3,,,,,,
718774,2023-03-30,New York Mets,Miami Marlins,5,3,7,top,51,0,1,3,596019,Francisco Lindor,L,608638,JT Chargois,R,Groundout,field_out,"Francisco Lindor grounds out, shortstop Joey Wendle to first baseman Garrett Cooper.",0,5,3,,,,,,
718774,2023-03-30,New York Mets,Miami Marlins,5,3,7,bottom,52,2,1,0,624585,Jorge Soler,R,622098,Drew Smith,R,Double,double,Jorge Soler doubles (1) on a sharp line drive to center fielder Brandon Nimmo.,0,5,3,,,,,,
718774,2023-03-30,New York Mets,Miami Marlins,5,3,7,bottom,53,0,0,1,541645,Avisaíl García,R,622098,Drew Smith,R,Flyout,field_out,Avisail Garcia flies out to center fielder Brandon Nimmo.,0,5,3,,,,,,
718774,2023-03-30,New York Mets,Miami Marlins,5,3,7,bottom,54,3,3,2,650559,Bryan De La Cruz,R,622098,Drew Smith,R,Strikeout,strikeout,Bryan De La Cruz strikes out on a foul tip.,0,5,3,,,,,,
718774,2023-03-30,New York Mets,Miami Marlins,5,3,7,bottom,55,3,3,3,607732,Jacob Stallings,R,622098,Drew Smith,R,Strikeout,strikeout,Jacob Stallings strikes out swinging.,0,5,3,,,,,,
718774,2023-03-30,New York Mets,Miami Marlins,5,3,8,top,56,2,0,1,624413,Pete Alonso,R,623211,Huascar Brazobán,R,Groundout,field_out,"Pete Alonso grounds out, second baseman Luis Arraez to first baseman Garrett Cooper.",0,5,3,,,,,,
718774,2023-03-30,New York Mets,Miami Marlins,5,3,8,top,57,0,0,1,643446,Jeff McNeil,L,623211,Huascar Brazobán,R,Single,single,Jeff McNeil singles on a bunt ground ball to third baseman Jean Segura.,0,5,3,,,,,,
718774,2023-03-30,New York Mets,Miami Marlins,5,3,8,top,58,2,2,1,592192,Mark Canha,R,623211,Huascar Brazobán,R,Hit By Pitch,hit_by_pitch,Mark Canha hit by pitch. Jeff McNeil to 2nd.,0,5,3,643446.0,Jeff McNeil,1B,2B,False,
718774,2023-03-30,New York Mets,Miami Marlins,5,3,8,top,59,2,3,2,502054,Tommy Pham,R,623211,Huascar Brazobán,R,Strikeout,strikeout,Tommy Pham strikes out swinging.,0,5,3,,,,,,
718774,2023-03-30,New York Mets,Miami Marlins,5,3,8,top,60,3,3,3,500871,Eduardo Escobar,L,623211,Huascar Brazobán,R,Strikeout,strikeout,Eduardo Escobar strikes out swinging.,0,5,3,643446.0,Jeff McNeil,2B,3B,False,
718774,2023-03-30,New York Mets,Miami Marlins,5,3,8,top,60,3,3,3,500871,Eduardo Escobar,L,623211,Huascar Brazobán,R,Strikeout,strikeout,Eduardo Escobar strikes out swinging.,0,5,3,592192.0,Mark Canha,1B,2B,False,
718774,2023-03-30,New York Mets,Miami Marlins,5,3,8,bottom,61,0,3,1,542932,Jon Berti,R,548384,Brooks Raley,L,Strikeout,strikeout,Jon Berti strikes out swinging.,0,5,3,,,,,,
718774,2023-03-30,New York Mets,Miami Marlins,5,3,8,bottom,62,2,3,2,650333,Luis Arraez,L,548384,Brooks Raley,L,Strikeout,strikeout,Luis Arraez strikes out on a foul tip.,0,5,3,,,,,,
718774,2023-03-30,New York Mets,Miami Marlins,5,3,8,bottom,63,1,2,3,516416,Jean Segura,R,548384,Brooks Raley,L,Groundout,field_out,"Jean Segura grounds out, shortstop Francisco Lindor to first baseman Pete Alonso.",0,5,3,,,,,,
718774,2023-03-30,New York Mets,Miami Marlins,5,3,9,top,64,0,1,1,553882,Omar Narváez,L,623211,Huascar Brazobán,R,Groundout,field_out,"Omar Narvaez grounds out, second baseman Luis Arraez to first baseman Garrett Cooper.",0,5,3,,,,,,
718774,2023-03-30,New York Mets,Miami Marlins,5,3,9,top,65,1,1,2,607043,Brandon Nimmo,L,623211,Huascar Brazobán,R,Groundout,field_out,Brandon Nimmo grounds out to first baseman Garrett Cooper.,0,5,3,,,,,,
718774,2023-03-30,New York Mets,Miami Marlins,5,3,9,top,66,2,0,2,516782,Starling Marte,R,623211,Huascar Brazobán,R,Single,single,Starling Marte singles on a ground ball to left fielder Bryan De La Cruz.,0,5,3,,,,,,
718774,2023-03-30,New York Mets,Miami Marlins,5,3,9,top,67,2,1,2,596019,Francisco Lindor,L,623211,Huascar Brazobán,R,Single,single,Francisco Lindor singles on a line drive to right fielder Avisail Garcia. Starling Marte to 2nd.,0,5,3,516782.0,Starling Marte,1B,2B,False,
718774,2023-03-30,New York Mets,Miami Marlins,5,3,9,top,68,1,3,3,624413,Pete Alonso,R,623211,Huascar Brazobán,R,Strikeout,strikeout,Pete Alonso strikes out swinging.,0,5,3,,,,,,
718774,2023-03-30,New York Mets,Miami Marlins,5,3,9,bottom,69,2,3,1,643265,Garrett Cooper,R,502085,David Robertson,R,Strikeout,strikeout,Garrett Cooper strikes out swinging.,0,5,3,,,,,,
718774,2023-03-30,New York Mets,Miami Marlins,5,3,9,bottom,70,2,3,2,665862,Jazz Chisholm Jr.,L,502085,David Robertson,R,Strikeout,strikeout,Jazz Chisholm Jr. strikes out swinging.,0,5,3,,,,,,
718774,2023-03-30,New York Mets,Miami Marlins,5,3,9,bottom,71,3,1,3,624585,Jorge Soler,R,502085,David Robertson,R,Flyout,field_out,Jorge Soler flies out to right fielder Starling Marte.,0,5,3,,,,,,
718768,2023-03-30,Chicago White Sox,Houston Astros,3,2,1,top,0,1,0,1,641313,Tim Anderson,R,664285,Framber Valdez,L,Groundout,field_out,"Tim Anderson grounds out, second baseman Mauricio Dubon to first baseman Jose Abreu.",0,0,0,,,,,,
718768,2023-03-30,Chicago White Sox,Houston Astros,3,2,1,top,1,3,2,1,673357,Luis Robert Jr.,R,664285,Framber Valdez,L,Single,single,Luis Robert Jr. singles on a soft ground ball to pitcher Framber Valdez.,0,0,0,,,,,,
718768,2023-03-30,Chicago White Sox,Houston Astros,3,2,1,top,2,0,1,2,683734,Andrew Vaughn,R,664285,Framber Valdez,L,Pop Out,field_out,Andrew Vaughn pops out to shortstop Jeremy Pena.,0,0,0,,,,,,
718768,2023-03-30,Chicago White Sox,Houston Astros,3,2,1,top,3,0,0,3,650391,Eloy Jiménez,R,664285,Framber Valdez,L,Forceout,force_out,"Eloy Jimenez grounds into a force out, shortstop Jeremy Pena to second baseman Mauricio Dubon. Luis Robert Jr. out at 2nd.",0,0,0,,,,,,
718768,2023-03-30,Chicago White Sox,Houston Astros,3,2,1,bottom,4,1,1,0,665161,Jeremy Peña,R,656302,Dylan Cease,R,Single,single,Jeremy Pena singles on a ground ball to center fielder Luis Robert Jr.,0,0,0,,,,,,
718768,2023-03-30,Chicago White Sox,Houston Astros,3,2,1,bottom,5,1,3,1,608324,Alex Bregman,R,656302,Dylan Cease,R,Strikeout,strikeout,Alex Bregman strikes out swinging.,0,0,0,,,,,,
718768,2023-03-30,Chicago White Sox,Houston Astros,3,2,1,bottom,6,2,3,2,670541,Yordan Alvarez,L,656302,Dylan Cease,R,Strikeout,strikeout,Yordan Alvarez strikes out swinging.,0,0,0,665161.0,Jeremy Peña,1B,2B,False,
718768,2023-03-30,Chicago White Sox,Houston Astros,3,2,1,bottom,7,1,3,3,547989,José Abreu,R,656302,Dylan Cease,R,Strikeout,strikeout,Jose Abreu strikes out swinging.,0,0,0,,,,,,
718768,2023-03-30,Chicago White Sox,Houston Astros,3,2,2,top,8,0,3,1,660162,Yoán Moncada,R,664285,Framber Valdez,L,Strikeout,strikeout,Yoan Moncada called out on strikes.,0,0,0,,,,,,
718768,2023-03-30,Chicago White Sox,Houston Astros,3,2,2,top,9,3,2,2,643217,Andrew Benintendi,L,664285,Framber Valdez,L,Lineout,field_out,Andrew Benintendi lines out sharply to first baseman Jose Abreu.,0,0,0,,,,,,
718768,2023-03-30,Chicago White Sox,Houston Astros,3,2,2,top,10,1,0,3,518735,Yasmani Grandal,R,664285,Framber Valdez,L,Groundout,field_out,"Yasmani Grandal grounds out, third baseman Alex Bregman to first baseman Jose Abreu.",0,0,0,,,,,,
718768,2023-03-30,Chicago White Sox,Houston Astros,3,2,2,bottom,11,2,3,1,663656,Kyle Tucker,L,656302,Dylan Cease,R,Strikeout,strikeout,Kyle Tucker called out on strikes.,0,0,0,,,,,,
718768,2023-03-30,Chicago White Sox,Houston Astros,3,2,2,bottom,12,1,2,2,673237,Yainer Diaz,R,656302,Dylan Cease,R,Flyout,field_out,Yainer Diaz flies out to center fielder Luis Robert Jr.,0,0,0,,,,,,
718768,2023-03-30,Chicago White Sox,Houston Astros,3,2,2,bottom,13,0,3,3,676694,Jake Meyers,R,656302,Dylan Cease,R,Strikeout,strikeout,Jake Meyers called out on strikes.,0,0,0,,,,,,
718768,2023-03-30,Chicago White Sox,Houston Astros,3,2,3,top,14,2,2,1,462101,Elvis Andrus,R,664285,Framber Valdez,L,Groundout,field_out,"Elvis Andrus grounds out, shortstop Jeremy Pena to first baseman Jose Abreu.",0,0,0,,,,,,
718768,2023-03-30,Chicago White Sox,Houston Astros,3,2,3,top,15,2,2,2,663853,Romy Gonzalez,R,664285,Framber Valdez,L,Groundout,field_out,Romy Gonzalez grounds out to first baseman Jose Abreu.,0,0,0,,,,,,
718768,2023-03-30,Chicago White Sox,Houston Astros,3,2,3,top,16,3,1,2,641313,Tim Anderson,R,664285,Framber Valdez,L,Double,double,Tim Anderson doubles (1) on a line drive to right fielder Kyle Tucker.,0,0,0,,,,,,
718768,2023-03-30,Chicago White Sox,Houston Astros,3,2,3,top,17,2,2,3,673357,Luis Robert Jr.,R,664285,Framber Valdez,L,Groundout,field_out,"Luis Robert Jr. grounds out, third baseman Alex Bregman to first baseman Jose Abreu.",0,0,0,,,,,,
718768,2023-03-30,Chicago White Sox,Houston Astros,3,2,3,bottom,18,1,3,1,455117,Martín Maldonado,R,656302,Dylan Cease,R,Strikeout,strikeout,Martin Maldonado called out on strikes.,0,0,0,,,,,,
718768,2023-03-30,Chicago White Sox,Houston Astros,3,2,3,bottom,19,1,2,2,643289,Mauricio Dubón,R,656302,Dylan Cease,R,Groundout,field_out,"Mauricio Dubon grounds out, second baseman Elvis Andrus to first baseman Andrew Vaughn.",0,0,0,,,,,,
718768,2023-03-30,Chicago White Sox,Houston Astros,3,2,3,bottom,20,2,3,3,665161,Jeremy Peña,R,656302,Dylan Cease,R,Strikeout,strikeout,Jeremy Pena strikes out swinging.,0,0,0,,,,,,
718768,2023-03-30,Chicago White Sox,Houston Astros,3,2,4,top,21,0,3,1,683734,Andrew Vaughn,R,664285,Framber Valdez,L,Strikeout,strikeout,"Andrew Vaughn strikes out swinging, catcher Martin Maldonado to first baseman Jose Abreu.",0,0,0,,,,,,
718768,2023-03-30,Chicago White Sox,Houston Astros,3,2,4,top,22,0,3,2,650391,Eloy Jiménez,R,664285,Framber Valdez,L,Strikeout,strikeout,Eloy Jimenez strikes out swinging.,0,0,0,,,,,,
718768,2023-03-30,Chicago White Sox,Houston Astros,3,2,4,top,23,2,2,2,660162,Yoán Moncada,R,664285,Framber Valdez,L,Single,single,Yoan Moncada singles on a ground ball to left fielder Yordan Alvarez.,0,0,0,,,,,,
718768,2023-03-30,Chicago White Sox,Houston Astros,3,2,4,top,24,0,0,2,643217,Andrew Benintendi,L,664285,Framber Valdez,L,Single,single,Andrew Benintendi singles on a ground ball to left fielder Yordan Alvarez. Yoan Moncada to 2nd.,0,0,0,660162.0,Yoán Moncada,1B,2B,False,
718768,2023-03-30,Chicago White Sox,Houston Astros,3,2,4,top,25,3,2,3,518735,Yasmani Grandal,R,664285,Framber Valdez,L,Groundout,field_out,"Yasmani Grandal grounds out, shortstop Jeremy Pena to first baseman Jose Abreu.",0,0,0,,,,,,
718768,2023-03-30,Chicago White Sox,Houston Astros,3,2,4,bottom,26,0,2,1,608324,Alex Bregman,R,656302,Dylan Cease,R,Flyout,field_out,Alex Bregman flies out to right fielder Romy Gonzalez.,0,0,0,,,,,,
718768,2023-03-30,Chicago White Sox,Houston Astros,3,2,4,bottom,27,3,3,2,670541,Yordan Alvarez,L,656302,Dylan Cease,R,Strikeout,strikeout,Yordan Alvarez strikes out swinging.,0,0,0,,,,,,
718768,2023-03-30,Chicago White Sox,Houston Astros,3,2,4,bottom,28,1,2,3,547989,José Abreu,R,656302,Dylan Cease,R,Groundout,field_out,"Jose Abreu grounds out, pitcher Dylan Cease to first baseman Andrew Vaughn.",0,0,0,,,,,,
718768,2023-03-30,Chicago White Sox,Houston Astros,3,2,5,top,29,2,1,0,462101,Elvis Andrus,R,664285,Framber Valdez,L,Single,single,Elvis Andrus singles on a sharp line drive to left fielder Yordan Alvarez.,0,0,0,,,,,,
718768,2023-03-30,Chicago White Sox,Houston Astros,3,2,5,top,30,1,2,0,663853,Romy Gonzalez,R,664285,Framber Valdez,L,Single,single,Romy Gonzalez singles on a sharp line drive to center fielder Jake Meyers. Elvis Andrus to 3rd.,0,0,0,462101.0,Elvis Andrus,1B,2B,False,
718768,2023-03-30,Chicago White Sox,Houston Astros,3,2,5,top,30,1,2,0,663853,Romy Gonzalez,R,664285,Framber Valdez,L,Single,single,Romy Gonzalez singles on a sharp line drive to center fielder Jake Meyers. Elvis Andrus to 3rd.,0,0,0,462101.0,Elvis Andrus,2B,3B,False,
718768,2023-03-30,Chicago White Sox,Houston Astros,3,2,5,top,31,0,0,1,641313,Tim Anderson,R,664285,Framber Valdez,L,Fielders Choice Out,fielders_choice_out,"Tim Anderson reaches on a fielder's choice out, third baseman Alex Bregman to catcher Martin Maldonado to third baseman Alex Bregman. Elvis Andrus out at home. Romy Gonzalez to 2nd.",0,0,0,663853.0,Romy Gonzalez,1B,2B,False,
718768,2023-03-30,Chicago White Sox,Houston Astros,3,2,5,top,32,2,3,2,673357,Luis Robert Jr.,R,664285,Framber Valdez,L,Strikeout,strikeout,Luis Robert Jr. strikes out swinging.,0,0,0,,,,,,
718768,2023-03-30,Chicago White Sox,Houston Astros,3,2,5,top,33,1,2,2,683734,Andrew Vaughn,R,664285,Framber Valdez,L,Hit By Pitch,hit_by_pitch,Andrew Vaughn hit by pitch. Romy Gonzalez to 3rd. Tim Anderson to 2nd.,0,0,0,663853.0,Romy Gonzalez,2B,3B,False,
718768,2023-03-30,Chicago White Sox,Houston Astros,3,2,5,top,33,1,2,2,683734,Andrew Vaughn,R,664285,Framber Valdez,L,Hit By Pitch,hit_by_pitch,Andrew Vaughn hit by pitch. Romy Gonzalez to 3rd. Tim Anderson to 2nd.,0,0,0,641313.0,Tim Anderson,1B,2B,False,
718768,2023-03-30,Chicago White Sox,Houston Astros,3,2,5,top,34,1,0,3,650391,Eloy Jiménez,R,664285,Framber Valdez,L,Forceout,force_out,"Eloy Jimenez grounds into a force out, second baseman Mauricio Dubon to shortstop Jeremy Pena. Andrew Vaughn out at 2nd.",0,0,0,,,,,,
718768,2023-03-30,Chicago White Sox,Houston Astros,3,2,5,bottom,35,0,0,1,663656,Kyle Tucker,L,656302,Dylan Cease,R,Lineout,field_out,Kyle Tucker lines out sharply to right fielder Romy Gonzalez.,0,0,0,,,,,,
718768,2023-03-30,Chicago White Sox,Houston Astros,3,2,5,bottom,36,1,2,2,673237,Yainer Diaz,R,656302,Dylan Cease,R,Lineout,field_out,Yainer Diaz lines out to first baseman Andrew Vaughn.,0,0,0,,,,,,
718768,2023-03-30,Chicago White Sox,Houston Astros,3,2,5,bottom,37,0,0,3,676694,Jake Meyers,R,656302,Dylan Cease,R,Flyout,field_out,Jake Meyers flies out sharply to center fielder Luis Robert Jr.,0,0,0,,,,,,
718768,2023-03-30,Chicago White Sox,Houston Astros,3,2,6,top,38,2,3,1,660162,Yoán Moncada,L,650556,Bryan Abreu,R,Strikeout,strikeout,Yoan Moncada strikes out swinging.,0,0,0,,,,,,
718768,2023-03-30,Chicago White Sox,Houston Astros,3,2,6,top,39,1,1,2,643217,Andrew Benintendi,L,650556,Bryan Abreu,R,Flyout,field_out,Andrew Benintendi flies out to left fielder Yordan Alvarez.,0,0,0,,,,,,
718768,2023-03-30,Chicago White Sox,Houston Astros,3,2,6,top,40,0,2,3,518735,Yasmani Grandal,L,650556,Bryan Abreu,R,Groundout,field_out,"Yasmani Grandal grounds out softly, pitcher Bryan Abreu to first baseman Jose Abreu.",0,0,0,,,,,,
718768,2023-03-30,Chicago White Sox,Houston Astros,3,2,6,bottom,41,1,2,1,455117,Martín Maldonado,R,656302,Dylan Cease,R,Flyout,field_out,Martin Maldonado flies out to center fielder Luis Robert Jr.,0,0,0,,,,,,
718768,2023-03-30,Chicago White Sox,Houston Astros,3,2,6,bottom,42,2,2,2,643289,Mauricio Dubón,R,656302,Dylan Cease,R,Groundout,field_out,"Mauricio Dubon grounds out, shortstop Tim Anderson to first baseman Andrew Vaughn.",0,0,0,,,,,,
718768,2023-03-30,Chicago White Sox,Houston Astros,3,2,6,bottom,43,2,3,3,665161,Jeremy Peña,R,656302,Dylan Cease,R,Strikeout,strikeout,Jeremy Pena strikes out swinging.,0,0,0,,,,,,
718768,2023-03-30,Chicago White Sox,Houston Astros,3,2,7,top,44,0,0,1,462101,Elvis Andrus,R,593576,Héctor Neris,R,Groundout,field_out,"Elvis Andrus grounds out, third baseman Alex Bregman to first baseman Jose Abreu.",0,0,0,,,,,,
718768,2023-03-30,Chicago White Sox,Houston Astros,3,2,7,top,45,2,0,1,693049,Oscar Colás,L,593576,Héctor Neris,R,Single,single,Oscar Colas singles on a ground ball to center fielder Jake Meyers.,0,0,0,,,,,,
718768,2023-03-30,Chicago White Sox,Houston Astros,3,2,7,top,46,0,1,1,641313,Tim Anderson,R,593576,Héctor Neris,R,Single,single,"Tim Anderson singles on a ground ball to left fielder Yordan Alvarez, deflected by shortstop Jeremy Pena. Oscar Colas to 2nd.",0,0,0,693049.0,Oscar Colás,1B,2B,False,
718768,2023-03-30,Chicago White Sox,Houston Astros,3,2,7,top,47,0,1,1,673357,Luis Robert Jr.,R,593576,Héctor Neris,R,Catcher Interference,catcher_interf,Luis Robert Jr. reaches on catcher interference by Martin Maldonado. Oscar Colas to 3rd. Tim Anderson to 2nd. Luis Robert Jr. to 1st.,0,0,0,693049.0,Oscar Colás,2B,3B,False,
718768,2023-03-30,Chicago White Sox,Houston Astros,3,2,7,top,47,0,1,1,673357,Luis Robert Jr.,R,593576,Héctor Neris,R,Catcher Interference,catcher_interf,Luis Robert Jr. reaches on catcher interference by Martin Maldonado. Oscar Colas to 3rd. Tim Anderson to 2nd. Luis Robert Jr. to 1st.,0,0,0,641313.0,Tim Anderson,1B,2B,False,
718768,2023-03-30,Chicago White Sox,Houston Astros,3,2,7,top,48,2,3,2,683734,Andrew Vaughn,R,593576,Héctor Neris,R,Strikeout,strikeout,Andrew Vaughn strikes out swinging.,0,0,0,,,,,,
718768,2023-03-30,Chicago White Sox,Houston Astros,3,2,7,top,49,1,3,3,650391,Eloy Jiménez,R,593576,Héctor Neris,R,Strikeout,strikeout,Eloy Jimenez strikes out swinging.,0,0,0,,,,,,
718768,2023-03-30,Chicago White Sox,Houston Astros,3,2,7,bottom,50,0,3,1,608324,Alex Bregman,R,656302,Dylan Cease,R,Strikeout,strikeout,Alex Bregman strikes out swinging.,0,0,0,,,,,,
718768,2023-03-30,Chicago White Sox,Houston Astros,3,2,7,bottom,51,1,0,1,670541,Yordan Alvarez,L,656302,Dylan Cease,R,Hit By Pitch,hit_by_pitch,Yordan Alvarez hit by pitch.,0,0,0,,,,,,
718768,2023-03-30,Chicago White Sox,Houston Astros,3,2,7,bottom,52,1,2,1,547989,José Abreu,R,656302,Dylan Cease,R,Single,single,Jose Abreu singles on a ground ball to left fielder Andrew Benintendi. Yordan Alvarez to 2nd.,0,0,0,670541.0,Yordan Alvarez,1B,2B,False,
718768,2023-03-30,Chicago White Sox,Houston Astros,3,2,7,bottom,53,4,2,1,663656,Kyle Tucker,L,607481,Aaron Bummer,L,Walk,walk,Kyle Tucker walks. Yordan Alvarez to 3rd. Jose Abreu to 2nd.,0,0,0,670541.0,Yordan Alvarez,2B,3B,False,
718768,2023-03-30,Chicago White Sox,Houston Astros,3,2,7,bottom,53,4,2,1,663656,Kyle Tucker,L,607481,Aaron Bummer,L,Walk,walk,Kyle Tucker walks. Yordan Alvarez to 3rd. Jose Abreu to 2nd.,0,0,0,547989.0,José Abreu,1B,2B,False,
718768,2023-03-30,Chicago White Sox,Houston Astros,3,2,7,bottom,54,1,3,2,673237,Yainer Diaz,R,607481,Aaron Bummer,L,Strikeout,strikeout,Yainer Diaz strikes out swinging.,0,0,0,,,,,,
718768,2023-03-30,Chicago White Sox,Houston Astros,3,2,7,bottom,55,3,3,3,676694,Jake Meyers,R,607481,Aaron Bummer,L,Strikeout,strikeout,Jake Meyers strikes out swinging.,0,0,1,670541.0,Yordan Alvarez,3B,score,False,
718768,2023-03-30,Chicago White Sox,Houston Astros,3,2,7,bottom,55,3,3,3,676694,Jake Meyers,R,607481,Aaron Bummer,L,Strikeout,strikeout,Jake Meyers strikes out swinging.,0,0,1,547989.0,José Abreu,2B,3B,False,
718768,2023-03-30,Chicago White Sox,Houston Astros,3,2,7,bottom,55,3,3,3,676694,Jake Meyers,R,607481,Aaron Bummer,L,Strikeout,strikeout,Jake Meyers strikes out swinging.,0,0,1,663656.0,Kyle Tucker,1B,2B,False,
718768,2023-03-30,Chicago White Sox,Houston Astros,3,2,8,top,56,0,0,1,660162,Yoán Moncada,L,606160,Rafael Montero,R,Field Error,field_error,"White Sox challenged (tag play), call on the field was upheld: Yoan Moncada reaches on a fielding error by first baseman Jose Abreu. Yoan Moncada out at 3rd on the throw, right fielder Kyle Tucker to second baseman Mauricio Dubon to third baseman Alex Bregman.",0,0,1,,,,,,
718768,2023-03-30,Chicago White Sox,Houston Astros,3,2,8,top,57,2,3,2,643217,Andrew Benintendi,L,606160,Rafael Montero,R,Strikeout,strikeout,Andrew Benintendi strikes out swinging.,0,0,1,,,,,,
718768,2023-03-30,Chicago White Sox,Houston Astros,3,2,8,top,58,1,0,2,518735,Yasmani Grandal,L,606160,Rafael Montero,R,Home Run,home_run,Yasmani Grandal homers (1) on a line drive to right center field.,1,1,1,,,,,,
718768,2023-03-30,Chicago White Sox,Houston Astros,3,2,8,top,59,0,1,3,462101,Elvis Andrus,R,606160,Rafael Montero,R,Groundout,field_out,"Elvis Andrus grounds out, third baseman Alex Bregman to first baseman Jose Abreu.",0,1,1,,,,,,
718768,2023-03-30,Chicago White Sox,Houston Astros,3,2,8,bottom,60,0,0,0,455117,Martín Maldonado,R,608665,Kendall Graveman,R,Single,single,Martin Maldonado singles on a line drive to left fielder Andrew Benintendi.,0,1,1,,,,,,
718768,2023-03-30,Chicago White Sox,Houston Astros,3,2,8,bottom,61,1,2,2,643289,Mauricio Dubón,R,608665,Kendall Graveman,R,Grounded Into DP,grounded_into_double_play,"Mauricio Dubon grounds into a double play, third baseman Yoan Moncada to second baseman Elvis Andrus to first baseman Andrew Vaughn. Martin Maldonado out at 2nd. Mauricio Dubon out at 1st.",0,1,1,,,,,,
718768,2023-03-30,Chicago White Sox,Houston Astros,3,2,8,bottom,62,2,1,3,665161,Jeremy Peña,R,608665,Kendall Graveman,R,Groundout,field_out,"Jeremy Pena grounds out, third baseman Yoan Moncada to first baseman Andrew Vaughn.",0,1,1,,,,,,
718768,2023-03-30,Chicago White Sox,Houston Astros,3,2,9,top,63,1,1,1,693049,Oscar Colás,L,519151,Ryan Pressly,R,Flyout,field_out,Oscar Colas flies out to right fielder Kyle Tucker.,0,1,1,,,,,,
718768,2023-03-30,Chicago White Sox,Houston Astros,3,2,9,top,64,4,1,1,641313,Tim Anderson,R,519151,Ryan Pressly,R,Walk,walk,Tim Anderson walks.,0,1,1,,,,,,
718768,2023-03-30,Chicago White Sox,Houston Astros,3,2,9,top,65,0,1,1,673357,Luis Robert Jr.,R,519151,Ryan Pressly,R,Single,single,Luis Robert Jr. singles on a ground ball to left fielder Yordan Alvarez. Tim Anderson to 2nd.,0,1,1,641313.0,Tim Anderson,1B,2B,False,
718768,2023-03-30,Chicago White Sox,Houston Astros,3,2,9,top,66,2,2,1,683734,Andrew Vaughn,R,519151,Ryan Pressly,R,Double,double,Andrew Vaughn doubles (1) on a sharp line drive to center fielder Jake Meyers. Tim Anderson scores. Luis Robert Jr. scores.,2,3,1,673357.0,Luis Robert Jr.,1B,3B,False,
718768,2023-03-30,Chicago White Sox,Houston Astros,3,2,9,top,66,2,2,1,683734,Andrew Vaughn,R,519151,Ryan Pressly,R,Double,double,Andrew Vaughn doubles (1) on a sharp line drive to center fielder Jake Meyers. Tim Anderson scores. Luis Robert Jr. scores.,2,3,1,673357.0,Luis Robert Jr.,3B,score,False,
718768,2023-03-30,Chicago White Sox,Houston Astros,3,2,9,top,66,2,2,1,683734,Andrew Vaughn,R,519151,Ryan Pressly,R,Double,double,Andrew Vaughn doubles (1) on a sharp line drive to center fielder Jake Meyers. Tim Anderson scores. Luis Robert Jr. scores.,2,3,1,641313.0,Tim Anderson,2B,score,False,
718768,2023-03-30,Chicago White Sox,Houston Astros,3,2,9,top,67,0,1,2,650391,Eloy Jiménez,R,519151,Ryan Pressly,R,Flyout,field_out,Eloy Jimenez flies out to right fielder Kyle Tucker in foul territory.,0,3,1,,,,,,
718768,2023-03-30,Chicago White Sox,Houston Astros,3,2,9,top,68,1,3,3,660162,Yoán Moncada,L,519151,Ryan Pressly,R,Strikeout,strikeout,Yoan Moncada strikes out swinging.,0,3,1,,,,,,
718768,2023-03-30,Chicago White Sox,Houston Astros,3,2,9,bottom,69,0,2,1,608324,Alex Bregman,R,625643,Reynaldo López,R,Groundout,field_out,"Alex Bregman grounds out, second baseman Elvis Andrus to first baseman Andrew Vaughn.",0,3,1,,,,,,
718768,2023-03-30,Chicago White Sox,Houston Astros,3,2,9,bottom,70,0,1,1,670541,Yordan Alvarez,L,625643,Reynaldo López,R,Home Run,home_run,Yordan Alvarez homers (1) on a fly ball to right center field.,1,3,2,,,,,,
718768,2023-03-30,Chicago White Sox,Houston Astros,3,2,9,bottom,71,3,2,2,547989,José Abreu,R,625643,Reynaldo López,R,Groundout,field_out,"Jose Abreu grounds out, third baseman Yoan Moncada to first baseman Andrew Vaughn.",0,3,2,,,,,,
718768,2023-03-30,Chicago White Sox,Houston Astros,3,2,9,bottom,72,4,1,2,663656,Kyle Tucker,L,625643,Reynaldo López,R,Walk,walk,Kyle Tucker walks.,0,3,2,,,,,,
718768,2023-03-30,Chicago White Sox,Houston Astros,3,2,9,bottom,73,1,3,3,673237,Yainer Diaz,R,625643,Reynaldo López,R,Strikeout,strikeout,Yainer Diaz strikes out swinging.,0,3,2,,,,,,
718778,2023-03-30,Colorado Rockies,San Diego Padres,7,2,1,top,0,0,3,1,602074,Yonathan Daza,R,605483,Blake Snell,L,Strikeout,strikeout,Yonathan Daza strikes out swinging.,0,0,0,,,,,,
718778,2023-03-30,Colorado Rockies,San Diego Padres,7,2,1,top,1,3,1,1,592178,Kris Bryant,R,605483,Blake Snell,L,Double,double,Kris Bryant doubles (1) on a sharp line drive to left fielder Juan Soto.,0,0,0,,,,,,
718778,2023-03-30,Colorado Rockies,San Diego Padres,7,2,1,top,2,1,0,1,453568,Charlie Blackmon,L,605483,Blake Snell,L,Single,single,Charlie Blackmon singles on a ground ball to left fielder Juan Soto. Kris Bryant to 3rd.,0,0,0,592178.0,Kris Bryant,2B,3B,False,
