game_id,game_date,away_team,home_team,away_score,home_score,inning,half_inning,at_bat_index,balls,strikes,outs,batter_id,batter_name,batter_side,pitcher_id,pitcher_name,pitcher_hand,event,event_type,description,rbi,away_score_after,home_score_after,runner_id,runner_name,start_base,end_base,is_out,out_number
718770,2023-03-30,Arizona Diamondbacks,Los Angeles Dodgers,2,8,7,top,53,1,3,3,605113,Nick Ahmed,R,641360,Phil Bickford,R,Strikeout,strikeout,Nick Ahmed strikes out swinging.,0,2,7,,,,,,
718770,2023-03-30,Arizona Diamondbacks,Los Angeles Dodgers,2,8,7,bottom,54,1,3,1,571970,Max Muncy,L,669459,Kyle Nelson,L,Strikeout,strikeout,Max Muncy strikes out swinging.,0,2,7,,,,,,
718770,2023-03-30,Arizona Diamondbacks,Los Angeles Dodgers,2,8,7,bottom,55,1,3,2,502110,J.D. Martinez,R,669459,Kyle Nelson,L,Strikeout,strikeout,J.D. Martinez strikes out swinging.,0,2,7,,,,,,
718770,2023-03-30,Arizona Diamondbacks,Los Angeles Dodgers,2,8,7,bottom,56,0,1,2,444482,David Peralta,L,669459,Kyle Nelson,L,Single,single,David Peralta singles on a line drive to left fielder Lourdes Gurriel Jr.,0,2,7,,,,,,
718770,2023-03-30,Arizona Diamondbacks,Los Angeles Dodgers,2,8,7,bottom,57,0,3,3,678246,Miguel Vargas,R,672841,Carlos Vargas,R,Strikeout,strikeout,Miguel Vargas strikes out swinging.,0,2,7,,,,,,
718770,2023-03-30,Arizona Diamondbacks,Los Angeles Dodgers,2,8,8,top,58,1,2,1,682998,Corbin Carroll,L,571946,Shelby Miller,R,Flyout,field_out,Corbin Carroll flies out to center fielder James Outman.,0,2,7,,,,,,
718770,2023-03-30,Arizona Diamondbacks,Los Angeles Dodgers,2,8,8,top,59,1,2,2,672515,Gabriel Moreno,R,571946,Shelby Miller,R,Flyout,field_out,Gabriel Moreno flies out to center fielder James Outman.,0,2,7,,,,,,
718770,2023-03-30,Arizona Diamondbacks,Los Angeles Dodgers,2,8,8,top,60,1,3,3,664983,Jake McCarthy,L,571946,Shelby Miller,R,Strikeout,strikeout,Jake McCarthy strikes out swinging.,0,2,7,,,,,,
718770,2023-03-30,Arizona Diamondbacks,Los Angeles Dodgers,2,8,8,bottom,61,1,1,0,681546,James Outman,L,672841,Carlos Vargas,R,Single,single,"James Outman singles on a line drive to right fielder Jake McCarthy. James Outman to 2nd. James Outman advances to 2nd, on a fielding error by right fielder Jake McCarthy.",0,2,7,681546.0,James Outman,1B,2B,False,
718770,2023-03-30,Arizona Diamondbacks,Los Angeles Dodgers,2,8,8,bottom,62,1,0,0,500743,Miguel Rojas,R,672841,Carlos Vargas,R,Single,single,Miguel Rojas singles on a ground ball to third baseman Evan Longoria. James Outman to 3rd.,0,2,7,681546.0,James Outman,2B,3B,False,
718770,2023-03-30,Arizona Diamondbacks,Los Angeles Dodgers,2,8,8,bottom,63,1,3,1,605141,Mookie Betts,R,672841,Carlos Vargas,R,Strikeout,strikeout,Mookie Betts called out on strikes.,0,2,7,,,,,,
718770,2023-03-30,Arizona Diamondbacks,Los Angeles Dodgers,2,8,8,bottom,64,4,2,1,518692,Freddie Freeman,L,672841,Carlos Vargas,R,Walk,walk,Freddie Freeman walks. Miguel Rojas to 2nd.,0,2,7,500743.0,Miguel Rojas,1B,2B,False,
718770,2023-03-30,Arizona Diamondbacks,Los Angeles Dodgers,2,8,8,bottom,65,3,2,2,669257,Will Smith,R,656464,Kevin Ginkel,R,Sac Fly,sac_fly,Will Smith out on a sacrifice fly to center fielder Corbin Carroll. James Outman scores.,1,2,8,681546.0,James Outman,3B,score,False,
718770,2023-03-30,Arizona Diamondbacks,Los Angeles Dodgers,2,8,8,bottom,66,2,3,3,571970,Max Muncy,L,656464,Kevin Ginkel,R,Strikeout,strikeout,Max Muncy strikes out swinging.,0,2,8,,,,,,
718770,2023-03-30,Arizona Diamondbacks,Los Angeles Dodgers,2,8,9,top,67,0,2,1,641786,Kyle Lewis,R,622075,Yency Almonte,R,Pop Out,field_out,Kyle Lewis pops out to catcher Will Smith in foul territory.,0,2,8,,,,,,
718770,2023-03-30,Arizona Diamondbacks,Los Angeles Dodgers,2,8,9,top,68,3,2,2,606466,Ketel Marte,L,622075,Yency Almonte,R,Flyout,field_out,Ketel Marte flies out to left fielder David Peralta.,0,2,8,,,,,,
718770,2023-03-30,Arizona Diamondbacks,Los Angeles Dodgers,2,8,9,top,69,0,0,3,666971,Lourdes Gurriel Jr.,R,622075,Yency Almonte,R,Groundout,field_out,"Lourdes Gurriel Jr. grounds out, shortstop Miguel Rojas to first baseman Freddie Freeman.",0,2,8,,,,,,
718767,2023-03-30,Cleveland Guardians,Seattle Mariners,0,3,1,top,0,3,2,1,680757,Steven Kwan,L,622491,Luis Castillo,R,Pop Out,field_out,Steven Kwan pops out to third baseman Eugenio Suarez in foul territory.,0,0,0,,,,,,
718767,2023-03-30,Cleveland Guardians,Seattle Mariners,0,3,1,top,1,0,3,2,642708,Amed Rosario,R,622491,Luis Castillo,R,Strikeout,strikeout,Amed Rosario strikes out swinging.,0,0,0,,,,,,
718767,2023-03-30,Cleveland Guardians,Seattle Mariners,0,3,1,top,2,0,2,3,608070,José Ramírez,L,622491,Luis Castillo,R,Groundout,field_out,Jose Ramirez grounds out softly to first baseman Ty France.,0,0,0,,,,,,
718767,2023-03-30,Cleveland Guardians,Seattle Mariners,0,3,1,bottom,3,3,3,1,677594,Julio Rodríguez,R,669456,Shane Bieber,R,Strikeout,strikeout,Julio Rodriguez strikes out swinging.,0,0,0,,,,,,
718767,2023-03-30,Cleveland Guardians,Seattle Mariners,0,3,1,bottom,4,2,2,2,543939,Kolten Wong,L,669456,Shane Bieber,R,Flyout,field_out,Kolten Wong flies out to center fielder Myles Straw.,0,0,0,,,,,,
718767,2023-03-30,Cleveland Guardians,Seattle Mariners,0,3,1,bottom,5,0,1,2,664034,Ty France,R,669456,Shane Bieber,R,Single,single,Ty France singles on a line drive to left fielder Steven Kwan.,0,0,0,,,,,,
718767,2023-03-30,Cleveland Guardians,Seattle Mariners,0,3,1,bottom,6,3,3,3,606192,Teoscar Hernández,R,669456,Shane Bieber,R,Strikeout,strikeout,Teoscar Hernandez strikes out swinging.,0,0,0,,,,,,
718767,2023-03-30,Cleveland Guardians,Seattle Mariners,0,3,2,top,7,3,2,1,605137,Josh Bell,L,622491,Luis Castillo,R,Groundout,field_out,"Josh Bell grounds out, shortstop J. P. Crawford to first baseman Ty France.",0,0,0,,,,,,
718767,2023-03-30,Cleveland Guardians,Seattle Mariners,0,3,2,top,8,0,2,2,647304,Josh Naylor,L,622491,Luis Castillo,R,Flyout,field_out,Josh Naylor flies out to center fielder Julio Rodriguez.,0,0,0,,,,,,
718767,2023-03-30,Cleveland Guardians,Seattle Mariners,0,3,2,top,9,1,2,3,665926,Andrés Giménez,L,622491,Luis Castillo,R,Pop Out,field_out,Andres Gimenez pops out to third baseman Eugenio Suarez in foul territory.,0,0,0,,,,,,
718767,2023-03-30,Cleveland Guardians,Seattle Mariners,0,3,2,bottom,10,0,1,1,663728,Cal Raleigh,L,669456,Shane Bieber,R,Flyout,field_out,Cal Raleigh flies out to left fielder Steven Kwan.,0,0,0,,,,,,
718767,2023-03-30,Cleveland Guardians,Seattle Mariners,0,3,2,bottom,11,0,1,1,553993,Eugenio Suárez,R,669456,Shane Bieber,R,Double,double,Eugenio Suarez doubles (1) on a fly ball to left fielder Steven Kwan.,0,0,0,,,,,,
718767,2023-03-30,Cleveland Guardians,Seattle Mariners,0,3,2,bottom,12,3,3,2,672284,Jarred Kelenic,L,669456,Shane Bieber,R,Strikeout,strikeout,Jarred Kelenic called out on strikes.,0,0,0,553993.0,Eugenio Suárez,2B,3B,False,
718767,2023-03-30,Cleveland Guardians,Seattle Mariners,0,3,2,bottom,13,0,1,3,600303,Tommy La Stella,L,669456,Shane Bieber,R,Lineout,field_out,Tommy La Stella lines out to left fielder Steven Kwan.,0,0,0,,,,,,
718767,2023-03-30,Cleveland Guardians,Seattle Mariners,0,3,3,top,14,0,1,0,686823,Will Brennan,L,622491,Luis Castillo,R,Single,single,"Will Brennan singles on a line drive to shortstop J. P. Crawford, deflected by pitcher Luis Castillo.",0,0,0,,,,,,
718767,2023-03-30,Cleveland Guardians,Seattle Mariners,0,3,3,top,15,2,3,1,572287,Mike Zunino,R,622491,Luis Castillo,R,Strikeout,strikeout,Mike Zunino strikes out swinging.,0,0,0,,,,,,
718767,2023-03-30,Cleveland Guardians,Seattle Mariners,0,3,3,top,16,0,3,2,664702,Myles Straw,R,622491,Luis Castillo,R,Strikeout,strikeout,Myles Straw strikes out swinging.,0,0,0,,,,,,
718767,2023-03-30,Cleveland Guardians,Seattle Mariners,0,3,3,top,17,1,3,3,680757,Steven Kwan,L,622491,Luis Castillo,R,Strikeout,strikeout,Steven Kwan strikes out swinging.,0,0,0,,,,,,
718767,2023-03-30,Cleveland Guardians,Seattle Mariners,0,3,3,bottom,18,0,0,0,641487,J.P. Crawford,L,669456,Shane Bieber,R,Single,single,J.P. Crawford singles on a line drive to center fielder Myles Straw.,0,0,0,,,,,,
718767,2023-03-30,Cleveland Guardians,Seattle Mariners,0,3,3,bottom,19,1,1,1,677594,Julio Rodríguez,R,669456,Shane Bieber,R,Flyout,field_out,Julio Rodriguez flies out to center fielder Myles Straw.,0,0,0,,,,,,
718767,2023-03-30,Cleveland Guardians,Seattle Mariners,0,3,3,bottom,20,1,1,2,543939,Kolten Wong,L,669456,Shane Bieber,R,Groundout,field_out,"Kolten Wong grounds out, second baseman Andres Gimenez to first baseman Josh Naylor. J.P. Crawford to 2nd.",0,0,0,641487.0,J.P. Crawford,1B,2B,False,
718767,2023-03-30,Cleveland Guardians,Seattle Mariners,0,3,3,bottom,21,3,2,3,664034,Ty France,R,669456,Shane Bieber,R,Groundout,field_out,"Ty France grounds out, pitcher Shane Bieber to first baseman Josh Naylor.",0,0,0,641487.0,J.P. Crawford,2B,3B,False,
718767,2023-03-30,Cleveland Guardians,Seattle Mariners,0,3,4,top,22,0,1,1,642708,Amed Rosario,R,622491,Luis Castillo,R,Groundout,field_out,"Amed Rosario grounds out softly, shortstop J. P. Crawford to first baseman Ty France.",0,0,0,,,,,,
718767,2023-03-30,Cleveland Guardians,Seattle Mariners,0,3,4,top,23,3,2,2,608070,José Ramírez,L,622491,Luis Castillo,R,Lineout,field_out,Jose Ramirez lines out sharply to right fielder Teoscar Hernandez.,0,0,0,,,,,,
718767,2023-03-30,Cleveland Guardians,Seattle Mariners,0,3,4,top,24,0,0,3,605137,Josh Bell,L,622491,Luis Castillo,R,Groundout,field_out,"Josh Bell grounds out, second baseman Kolten Wong to first baseman Ty France.",0,0,0,,,,,,
718767,2023-03-30,Cleveland Guardians,Seattle Mariners,0,3,4,bottom,25,1,1,1,606192,Teoscar Hernández,R,669456,Shane Bieber,R,Groundout,field_out,"Teoscar Hernandez grounds out, third baseman Jose Ramirez to first baseman Josh Naylor.",0,0,0,,,,,,
718767,2023-03-30,Cleveland Guardians,Seattle Mariners,0,3,4,bottom,26,1,1,1,663728,Cal Raleigh,L,669456,Shane Bieber,R,Single,single,"Cal Raleigh singles on a ground ball to third baseman Jose Ramirez, deflected by pitcher Shane Bieber.",0,0,0,,,,,,
718767,2023-03-30,Cleveland Guardians,Seattle Mariners,0,3,4,bottom,27,0,1,3,553993,Eugenio Suárez,R,669456,Shane Bieber,R,Grounded Into DP,grounded_into_double_play,"Eugenio Suarez grounds into a double play, third baseman Jose Ramirez to second baseman Andres Gimenez to first baseman Josh Naylor. Cal Raleigh out at 2nd. Eugenio Suarez out at 1st.",0,0,0,,,,,,
718767,2023-03-30,Cleveland Guardians,Seattle Mariners,0,3,5,top,28,0,2,1,647304,Josh Naylor,L,622491,Luis Castillo,R,Lineout,field_out,Josh Naylor lines out to right fielder Teoscar Hernandez.,0,0,0,,,,,,
718767,2023-03-30,Cleveland Guardians,Seattle Mariners,0,3,5,top,29,1,3,2,665926,Andrés Giménez,L,622491,Luis Castillo,R,Strikeout,strikeout,Andres Gimenez strikes out swinging.,0,0,0,,,,,,
718767,2023-03-30,Cleveland Guardians,Seattle Mariners,0,3,5,top,30,0,0,3,686823,Will Brennan,L,622491,Luis Castillo,R,Groundout,field_out,"Will Brennan grounds out, shortstop J. P. Crawford to first baseman Ty France.",0,0,0,,,,,,
718767,2023-03-30,Cleveland Guardians,Seattle Mariners,0,3,5,bottom,31,1,2,0,672284,Jarred Kelenic,L,669456,Shane Bieber,R,Single,single,"Jarred Kelenic singles on a ground ball to right fielder Will Brennan, deflected by second baseman Andres Gimenez.",0,0,0,,,,,,
718767,2023-03-30,Cleveland Guardians,Seattle Mariners,0,3,5,bottom,32,1,2,1,600303,Tommy La Stella,L,669456,Shane Bieber,R,Groundout,field_out,"Tommy La Stella grounds out, first baseman Josh Naylor to pitcher Shane Bieber. Jarred Kelenic to 3rd.",0,0,0,672284.0,Jarred Kelenic,1B,2B,False,
718767,2023-03-30,Cleveland Guardians,Seattle Mariners,0,3,5,bottom,32,1,2,1,600303,Tommy La Stella,L,669456,Shane Bieber,R,Groundout,field_out,"Tommy La Stella grounds out, first baseman Josh Naylor to pitcher Shane Bieber. Jarred Kelenic to 3rd.",0,0,0,672284.0,Jarred Kelenic,2B,3B,False,
718767,2023-03-30,Cleveland Guardians,Seattle Mariners,0,3,5,bottom,33,3,2,2,641487,J.P. Crawford,L,669456,Shane Bieber,R,Groundout,field_out,J.P. Crawford grounds out to first baseman Josh Naylor.,0,0,0,,,,,,
718767,2023-03-30,Cleveland Guardians,Seattle Mariners,0,3,5,bottom,34,1,0,3,677594,Julio Rodríguez,R,669456,Shane Bieber,R,Lineout,field_out,Julio Rodriguez lines out to right fielder Will Brennan.,0,0,0,,,,,,
718767,2023-03-30,Cleveland Guardians,Seattle Mariners,0,3,6,top,35,2,3,1,572287,Mike Zunino,R,622491,Luis Castillo,R,Strikeout,strikeout,Mike Zunino strikes out swinging.,0,0,0,,,,,,
718767,2023-03-30,Cleveland Guardians,Seattle Mariners,0,3,6,top,36,0,2,2,664702,Myles Straw,R,622491,Luis Castillo,R,Pop Out,field_out,Myles Straw pops out to catcher Cal Raleigh in foul territory.,0,0,0,,,,,,
718767,2023-03-30,Cleveland Guardians,Seattle Mariners,0,3,6,top,37,1,2,3,680757,Steven Kwan,L,622491,Luis Castillo,R,Flyout,field_out,Steven Kwan flies out to center fielder Julio Rodriguez.,0,0,0,,,,,,
718767,2023-03-30,Cleveland Guardians,Seattle Mariners,0,3,6,bottom,38,3,2,1,543939,Kolten Wong,L,669456,Shane Bieber,R,Lineout,field_out,Kolten Wong lines out sharply to first baseman Josh Naylor.,0,0,0,,,,,,
718767,2023-03-30,Cleveland Guardians,Seattle Mariners,0,3,6,bottom,39,1,1,1,664034,Ty France,R,669456,Shane Bieber,R,Double,double,Ty France doubles (1) on a sharp line drive to center fielder Myles Straw.,0,0,0,,,,,,
718767,2023-03-30,Cleveland Guardians,Seattle Mariners,0,3,6,bottom,40,1,2,2,606192,Teoscar Hernández,R,669456,Shane Bieber,R,Groundout,field_out,"Teoscar Hernandez grounds out, second baseman Andres Gimenez to first baseman Josh Naylor. Ty France to 3rd.",0,0,0,664034.0,Ty France,2B,3B,False,
718767,2023-03-30,Cleveland Guardians,Seattle Mariners,0,3,6,bottom,41,1,1,3,663728,Cal Raleigh,L,669456,Shane Bieber,R,Flyout,field_out,Cal Raleigh flies out to left fielder Steven Kwan.,0,0,0,,,,,,
718767,2023-03-30,Cleveland Guardians,Seattle Mariners,0,3,7,top,42,1,3,1,642708,Amed Rosario,R,666374,Matt Brash,R,Strikeout,strikeout,Amed Rosario strikes out swinging.,0,0,0,,,,,,
718767,2023-03-30,Cleveland Guardians,Seattle Mariners,0,3,7,top,43,3,3,2,608070,José Ramírez,L,666374,Matt Brash,R,Strikeout,strikeout,Jose Ramirez strikes out swinging.,0,0,0,,,,,,
718767,2023-03-30,Cleveland Guardians,Seattle Mariners,0,3,7,top,44,2,1,2,605137,Josh Bell,L,666374,Matt Brash,R,Single,single,Josh Bell singles on a ground ball to right fielder Teoscar Hernandez.,0,0,0,,,,,,
718767,2023-03-30,Cleveland Guardians,Seattle Mariners,0,3,7,top,45,2,1,3,647304,Josh Naylor,L,666374,Matt Brash,R,Flyout,field_out,Josh Naylor flies out to left fielder Jarred Kelenic.,0,0,0,,,,,,
718767,2023-03-30,Cleveland Guardians,Seattle Mariners,0,3,7,bottom,46,2,3,1,553993,Eugenio Suárez,R,663986,Trevor Stephan,R,Strikeout,strikeout,Eugenio Suarez strikes out swinging.,0,0,0,,,,,,
718767,2023-03-30,Cleveland Guardians,Seattle Mariners,0,3,7,bottom,47,3,2,2,672284,Jarred Kelenic,L,663986,Trevor Stephan,R,Flyout,field_out,Jarred Kelenic flies out sharply to center fielder Myles Straw.,0,0,0,,,,,,
718767,2023-03-30,Cleveland Guardians,Seattle Mariners,0,3,7,bottom,48,0,0,3,600303,Tommy La Stella,L,663986,Trevor Stephan,R,Groundout,field_out,"Tommy La Stella grounds out, third baseman Jose Ramirez to first baseman Josh Naylor.",0,0,0,,,,,,
718767,2023-03-30,Cleveland Guardians,Seattle Mariners,0,3,8,top,49,1,1,1,665926,Andrés Giménez,L,623149,Paul Sewald,R,Pop Out,field_out,Andres Gimenez pops out to third baseman Eugenio Suarez in foul territory.,0,0,0,,,,,,
718767,2023-03-30,Cleveland Guardians,Seattle Mariners,0,3,8,top,50,0,3,2,686823,Will Brennan,L,623149,Paul Sewald,R,Strikeout,strikeout,Will Brennan strikes out swinging.,0,0,0,,,,,,
718767,2023-03-30,Cleveland Guardians,Seattle Mariners,0,3,8,top,51,1,2,3,572287,Mike Zunino,R,623149,Paul Sewald,R,Flyout,field_out,Mike Zunino flies out to center fielder Julio Rodriguez.,0,0,0,,,,,,
718767,2023-03-30,Cleveland Guardians,Seattle Mariners,0,3,8,bottom,52,4,2,0,641487,J.P. Crawford,L,675916,James Karinchak,R,Walk,walk,J.P. Crawford walks.,0,0,0,,,,,,
718767,2023-03-30,Cleveland Guardians,Seattle Mariners,0,3,8,bottom,53,3,2,1,677594,Julio Rodríguez,R,675916,James Karinchak,R,Flyout,field_out,Julio Rodriguez flies out to center fielder Myles Straw.,0,0,0,,,,,,
718767,2023-03-30,Cleveland Guardians,Seattle Mariners,0,3,8,bottom,54,4,2,1,543939,Kolten Wong,L,675916,James Karinchak,R,Hit By Pitch,hit_by_pitch,Kolten Wong hit by pitch. J.P. Crawford to 2nd.,0,0,0,641487.0,J.P. Crawford,1B,2B,False,
718767,2023-03-30,Cleveland Guardians,Seattle Mariners,0,3,8,bottom,55,1,1,1,664034,Ty France,R,675916,James Karinchak,R,Home Run,home_run,Ty France homers (1) on a fly ball to right field. J.P. Crawford scores. Kolten Wong scores.,3,0,3,641487.0,J.P. Crawford,2B,score,False,
718767,2023-03-30,Cleveland Guardians,Seattle Mariners,0,3,8,bottom,55,1,1,1,664034,Ty France,R,675916,James Karinchak,R,Home Run,home_run,Ty France homers (1) on a fly ball to right field. J.P. Crawford scores. Kolten Wong scores.,3,0,3,543939.0,Kolten Wong,1B,score,False,
718767,2023-03-30,Cleveland Guardians,Seattle Mariners,0,3,8,bottom,56,1,3,2,606192,Teoscar Hernández,R,660853,Enyel De Los Santos,R,Strikeout,strikeout,Teoscar Hernandez strikes out swinging.,0,0,3,,,,,,
718767,2023-03-30,Cleveland Guardians,Seattle Mariners,0,3,8,bottom,57,0,1,3,663728,Cal Raleigh,L,660853,Enyel De Los Santos,R,Flyout,field_out,Cal Raleigh flies out to left fielder Steven Kwan.,0,0,3,,,,,,
718767,2023-03-30,Cleveland Guardians,Seattle Mariners,0,3,9,top,58,1,0,1,664702,Myles Straw,R,662253,Andrés Muñoz,R,Groundout,field_out,"Myles Straw grounds out, shortstop J. P. Crawford to first baseman Ty France.",0,0,3,,,,,,
718767,2023-03-30,Cleveland Guardians,Seattle Mariners,0,3,9,top,59,1,2,2,680757,Steven Kwan,L,662253,Andrés Muñoz,R,Groundout,field_out,"Steven Kwan grounds out, third baseman Eugenio Suarez to first baseman Ty France.",0,0,3,,,,,,
718767,2023-03-30,Cleveland Guardians,Seattle Mariners,0,3,9,top,60,1,1,2,642708,Amed Rosario,R,662253,Andrés Muñoz,R,Single,single,Amed Rosario singles on a ground ball to left fielder Jarred Kelenic.,0,0,3,,,,,,
718767,2023-03-30,Cleveland Guardians,Seattle Mariners,0,3,9,top,61,0,0,2,608070,José Ramírez,L,662253,Andrés Muñoz,R,Double,double,Jose Ramirez doubles (1) on a line drive to right fielder Teoscar Hernandez. Amed Rosario to 3rd.,0,0,3,642708.0,Amed Rosario,1B,3B,False,
718767,2023-03-30,Cleveland Guardians,Seattle Mariners,0,3,9,top,62,2,2,3,605137,Josh Bell,L,662253,Andrés Muñoz,R,Groundout,field_out,"Josh Bell grounds out, first baseman Ty France to pitcher Andres Munoz.",0,0,3,,,,,,
718771,2023-03-31,New York Mets,Miami Marlins,1,2,1,top,0,3,2,1,607043,Brandon Nimmo,L,666200,Jesús Luzardo,L,Groundout,field_out,"Mets challenged (play at 1st), call on the field was upheld: Brandon Nimmo grounds out, shortstop Jon Berti to first baseman Yuli Gurriel.",0,0,0,,,,,,
718771,2023-03-31,New York Mets,Miami Marlins,1,2,1,top,1,3,2,2,516782,Starling Marte,R,666200,Jesús Luzardo,L,Pop Out,field_out,Starling Marte pops out to second baseman Luis Arraez.,0,0,0,,,,,,
718771,2023-03-31,New York Mets,Miami Marlins,1,2,1,top,2,3,3,3,596019,Francisco Lindor,R,666200,Jesús Luzardo,L,Strikeout,strikeout,Francisco Lindor strikes out swinging.,0,0,0,,,,,,
718771,2023-03-31,New York Mets,Miami Marlins,1,2,1,bottom,3,4,2,0,650333,Luis Arraez,L,656849,David Peterson,L,Walk,walk,Luis Arraez walks.,0,0,0,,,,,,
718771,2023-03-31,New York Mets,Miami Marlins,1,2,1,bottom,4,3,1,2,516416,Jean Segura,R,656849,David Peterson,L,Grounded Into DP,grounded_into_double_play,"Jean Segura grounds into a double play, first baseman Pete Alonso to shortstop Francisco Lindor. Luis Arraez out at 2nd. Jean Segura out at 1st.",0,0,0,,,,,,
718771,2023-03-31,New York Mets,Miami Marlins,1,2,1,bottom,5,1,0,2,643265,Garrett Cooper,R,656849,David Peterson,L,Triple,triple,Garrett Cooper triples (1) on a fly ball to right fielder Starling Marte.,0,0,0,,,,,,
718771,2023-03-31,New York Mets,Miami Marlins,1,2,1,bottom,6,2,1,3,665862,Jazz Chisholm Jr.,L,656849,David Peterson,L,Groundout,field_out,"Jazz Chisholm Jr. grounds out, pitcher David Peterson to first baseman Pete Alonso.",0,0,0,,,,,,
718771,2023-03-31,New York Mets,Miami Marlins,1,2,2,top,7,0,1,1,624413,Pete Alonso,R,666200,Jesús Luzardo,L,Flyout,field_out,Pete Alonso flies out to right fielder Jorge Soler.,0,0,0,,,,,,
718771,2023-03-31,New York Mets,Miami Marlins,1,2,2,top,8,1,0,2,592192,Mark Canha,R,666200,Jesús Luzardo,L,Pop Out,field_out,Mark Canha pops out to first baseman Yuli Gurriel in foul territory.,0,0,0,,,,,,
718771,2023-03-31,New York Mets,Miami Marlins,1,2,2,top,9,0,3,3,643446,Jeff McNeil,L,666200,Jesús Luzardo,L,Strikeout,strikeout,Jeff McNeil strikes out swinging.,0,0,0,,,,,,
718771,2023-03-31,New York Mets,Miami Marlins,1,2,2,bottom,10,0,0,0,624585,Jorge Soler,R,656849,David Peterson,L,Home Run,home_run,Jorge Soler homers (1) on a fly ball to center field.,1,0,1,,,,,,
718771,2023-03-31,New York Mets,Miami Marlins,1,2,2,bottom,11,2,0,1,541645,Avisaíl García,R,656849,David Peterson,L,Groundout,field_out,"Avisail Garcia grounds out, first baseman Pete Alonso to pitcher David Peterson.",0,0,1,,,,,,
718771,2023-03-31,New York Mets,Miami Marlins,1,2,2,bottom,12,1,2,1,493329,Yuli Gurriel,R,656849,David Peterson,L,Single,single,Yuli Gurriel singles on a ground ball to left fielder Tommy Pham.,0,0,1,,,,,,
718771,2023-03-31,New York Mets,Miami Marlins,1,2,2,bottom,13,0,0,1,663743,Nick Fortes,R,656849,David Peterson,L,Single,single,Nick Fortes singles on a ground ball to right fielder Starling Marte. Yuli Gurriel to 3rd.,0,0,1,493329.0,Yuli Gurriel,1B,2B,False,
718771,2023-03-31,New York Mets,Miami Marlins,1,2,2,bottom,13,0,0,1,663743,Nick Fortes,R,656849,David Peterson,L,Single,single,Nick Fortes singles on a ground ball to right fielder Starling Marte. Yuli Gurriel to 3rd.,0,0,1,493329.0,Yuli Gurriel,2B,3B,False,
718771,2023-03-31,New York Mets,Miami Marlins,1,2,2,bottom,14,1,3,2,542932,Jon Berti,R,656849,David Peterson,L,Strikeout,strikeout,Jon Berti strikes out swinging.,0,0,1,,,,,,
718771,2023-03-31,New York Mets,Miami Marlins,1,2,2,bottom,15,3,1,3,650333,Luis Arraez,L,656849,David Peterson,L,Groundout,field_out,Luis Arraez grounds out to first baseman Pete Alonso.,0,0,1,,,,,,
718771,2023-03-31,New York Mets,Miami Marlins,1,2,3,top,16,1,0,1,500871,Eduardo Escobar,R,666200,Jesús Luzardo,L,Pop Out,field_out,Eduardo Escobar pops out to first baseman Yuli Gurriel.,0,0,1,,,,,,
718771,2023-03-31,New York Mets,Miami Marlins,1,2,3,top,17,1,1,2,502054,Tommy Pham,R,666200,Jesús Luzardo,L,Groundout,field_out,Tommy Pham grounds out softly to pitcher Jesus Luzardo.,0,0,1,,,,,,
718771,2023-03-31,New York Mets,Miami Marlins,1,2,3,top,18,1,3,3,621512,Tomás Nido,R,666200,Jesús Luzardo,L,Strikeout,strikeout,Tomas Nido strikes out swinging.,0,0,1,,,,,,
718771,2023-03-31,New York Mets,Miami Marlins,1,2,3,bottom,19,0,3,1,516416,Jean Segura,R,656849,David Peterson,L,Strikeout,strikeout,Jean Segura strikes out swinging.,0,0,1,,,,,,
718771,2023-03-31,New York Mets,Miami Marlins,1,2,3,bottom,20,3,2,1,643265,Garrett Cooper,R,656849,David Peterson,L,Single,single,Garrett Cooper singles on a ground ball to right fielder Starling Marte.,0,0,1,,,,,,
718771,2023-03-31,New York Mets,Miami Marlins,1,2,3,bottom,21,2,3,2,665862,Jazz Chisholm Jr.,L,656849,David Peterson,L,Strikeout,strikeout,Jazz Chisholm Jr. strikes out swinging.,0,0,1,,,,,,
718771,2023-03-31,New York Mets,Miami Marlins,1,2,3,bottom,22,0,1,3,624585,Jorge Soler,R,656849,David Peterson,L,Lineout,field_out,Jorge Soler lines out sharply to shortstop Francisco Lindor.,0,0,1,,,,,,
718771,2023-03-31,New York Mets,Miami Marlins,1,2,4,top,23,2,2,1,607043,Brandon Nimmo,L,666200,Jesús Luzardo,L,Groundout,field_out,"Brandon Nimmo grounds out, second baseman Luis Arraez to first baseman Yuli Gurriel.",0,0,1,,,,,,
718771,2023-03-31,New York Mets,Miami Marlins,1,2,4,top,24,1,0,1,516782,Starling Marte,R,666200,Jesús Luzardo,L,Single,single,Starling Marte singles on a line drive to right fielder Jorge Soler.,0,0,1,,,,,,
718771,2023-03-31,New York Mets,Miami Marlins,1,2,4,top,25,4,2,2,596019,Francisco Lindor,R,666200,Jesús Luzardo,L,Walk,walk,Francisco Lindor walks.,0,0,1,,,,,,
718771,2023-03-31,New York Mets,Miami Marlins,1,2,4,top,26,1,0,3,624413,Pete Alonso,R,666200,Jesús Luzardo,L,Groundout,field_out,"Pete Alonso grounds out, pitcher Jesus Luzardo to first baseman Yuli Gurriel.",0,0,1,,,,,,
718771,2023-03-31,New York Mets,Miami Marlins,1,2,4,bottom,27,2,3,1,541645,Avisaíl García,R,656849,David Peterson,L,Strikeout,strikeout,Avisail Garcia strikes out swinging.,0,0,1,,,,,,
718771,2023-03-31,New York Mets,Miami Marlins,1,2,4,bottom,28,0,2,2,493329,Yuli Gurriel,R,656849,David Peterson,L,Flyout,field_out,Yuli Gurriel flies out to center fielder Brandon Nimmo.,0,0,1,,,,,,
718771,2023-03-31,New York Mets,Miami Marlins,1,2,4,bottom,29,3,0,3,663743,Nick Fortes,R,656849,David Peterson,L,Groundout,field_out,"Nick Fortes grounds out, third baseman Eduardo Escobar to first baseman Pete Alonso.",0,0,1,,,,,,
718771,2023-03-31,New York Mets,Miami Marlins,1,2,5,top,30,4,2,0,592192,Mark Canha,R,666200,Jesús Luzardo,L,Walk,walk,Mark Canha walks.,0,0,1,,,,,,
718771,2023-03-31,New York Mets,Miami Marlins,1,2,5,top,31,1,2,2,643446,Jeff McNeil,L,666200,Jesús Luzardo,L,Grounded Into DP,grounded_into_double_play,"Jeff McNeil grounds into a double play, pitcher Jesus Luzardo to shortstop Jon Berti to first baseman Yuli Gurriel. Mark Canha out at 2nd. Jeff McNeil out at 1st.",0,0,1,,,,,,
718771,2023-03-31,New York Mets,Miami Marlins,1,2,5,top,32,2,3,3,500871,Eduardo Escobar,R,666200,Jesús Luzardo,L,Strikeout,strikeout,Eduardo Escobar strikes out swinging.,0,0,1,,,,,,
718771,2023-03-31,New York Mets,Miami Marlins,1,2,5,bottom,33,1,0,0,542932,Jon Berti,R,656849,David Peterson,L,Single,single,Jon Berti singles on a line drive to center fielder Brandon Nimmo.,0,0,1,,,,,,
